product_id,name,brand,short_description,description,category,image,price_current,price_original,discount_percent,rating,reviews_count,monthly_sales,sell_progress,inventory_qty,status,status_updated_at,created_at,updated_at,catalog
53e4d7ed-cace-4bd5-88a7-8faaeee63b22,Son Lì Naris Ailus Mịn Môi Màu 01 Đỏ Thuần 4g,Naris Cosmetics,Stress Free Lipstick #01 Be Strong,"Son Lì Mịn Môi Naris Ailus Stress Free Lipstick 4g là dòng son môi đến từ thương hiệu Ailus thuộc Naris Cosmetics Nhật Bản. Không chỉ giúp tô điểm cho đôi môi thật nổi bật và quyến rũ chỉ sau một lần thoa, sản phẩm còn sở hữu công nghệ giải tỏa stress giúp tăng cường dưỡng ẩm và bảo vệ đôi môi trước ánh sáng xanh, mang lại hiệu quả lâu trôi lên đến 6 giờ. Hiện sản phẩm Son Lì Naris Ailus Stress Free Lipstick 4g chính hãng đã có tại Hasaki đang có 4 tông màu cho bạn lựa chọn: 01 Be Strong - Đỏ Thuần 02 Be Confident - Đỏ Cam 03 Be Brave - Cam 05 Be Yourself - Hồng Đào Ưu thế nổi bật của Son Lì Naris Ailus Stress Free Lipstick: Thành phần giàu dưỡng chất từ dầu Jojoba, mật ong, Hyaluronic Acid giúp dưỡng ẩm cho da môi mềm mịn, ngăn ngừa khô nẻ, bong tróc. Tinh chất Trà Xanh Nhật Bản với đặc tính chống oxy hóa giúp bảo vệ da môi khỏi tia UV. Công nghệ giải tỏa stress giúp tăng cường dưỡng ẩm và bảo vệ đôi môi trước ánh sáng xanh. Công nghệ Ultra ColorStay giúp màu son bền màu, giữ lâu trên môi đến 6 tiếng đồng hồ. Hướng dẫn bảo quản Son Lì Naris Ailus Stress Free Lipstick: Nơi khô ráo thoáng mát. Tránh ánh nắng trực tiếp, nơi có nhiệt độ cao hoặc ẩm ướt. Đậy nắp kín sau khi sử dụng. Lưu ý: Ngày sản xuất: Xem chi tiết trên bao bì. Hạn sử dụng: 05 năm kể từ ngày sản xuất. Lưu ý: Tác dụng có thể khác nhau tuỳ cơ địa của người dùng Làm sao để phân biệt hàng có trộn hay không? Hàng trộn sẽ không thể xuất hoá đơn GTGT (VAT) 100% được do có hàng không nguồn gốc trong đó. Tại Hasaki, 100% hàng bán ra sẽ được xuất hoá đơn GTGT cho dù khách hàng có lấy hay không. Nếu có nhu cầu lấy hoá đơn GTGT, quý khách vui lòng cung cấp thông tin xuất hóa đơn trong vòng 2 giờ sau khi nhận hàng và trước 22h30 cùng ngày. 2 giờ sau khi giao hàng thành công, hệ thống Hasaki sẽ tự động xuất hết hoá đơn cho những hàng hoá mà khách hàng không đăng kí lấy hoá đơn. Do 100% hàng hóa bán ra đều được xuất hết hóa đơn GTGT trong ngày nên đảm bảo 100% hàng tại Hasaki là hàng chính hãng có nguồn gốc rõ ràng. Thu gọn",Chưa rõ,https://media.hcdn.vn/catalog/product/f/a/facebook-dynamic-son-thoi-min-moi-naris-cosmetic-ailus-01-be-strong-4g-1734511565_img_320x320_b04c1a_fit_center.jpg,263000,329000,20,5,0,Chưa có,Chưa có,205,AVAILABLE,2025-12-08 04:40:56.968+00,2025-12-08 04:40:56.945+00,2025-12-08 04:40:56.945+00,Other
df83e309-3a6e-477b-b92e-fe9fda974a1e,Son Kem Lì Silkygirl Lâu Trôi 04 Kissy - Đỏ Cam 2ml,Silkygirl,Slay All Day Lip Cream,"Son Kem Lì Silkygirl Lâu Trôi 2ml là sản phẩm son kem đến từ thương hiệu mỹ phẩm Silkygirl của Malaysia. Sản phẩm với chất son kem mướt mịn, nhẹ môi, đặc biệt khả năng bền màu lâu trôi đến 12 giờ giúp đôi môi nàng rạng rỡ sắc son. Hiện sản phẩm Son Kem Lì Silkygirl Slay All Day Lip Cream 2ml đã có mặt tại Hasaki với 4 màu: 02 Fancy - Cánh Hồng Khô: Màu Hồng Đất 04 Kissy - Cà Chua Mọng: Màu Đỏ Cam 05 Edgy - Ớt Cay Nồng: Màu Đỏ Thuần 06 Bubbly - Socola Cổ Điển: Màu Đỏ Đất Ưu thế nổi bật: Bộ sưu tập 4 màu son thiên cam - đỏ quyến rũ giúp nàng tỏa sáng mọi buổi tiệc. Son lên chuẩn sắc chỉ lần lướt cọ đầu tiên và giữ màu đến 12 tiếng và có một lớp base hồng nhẹ giúp môi luôn có sức sống. Sodium Hyaluronate cung cấp độ ẩm giúp môi trông mịn màng và đầy đặn hơn. Rose Hip Oil giảm nếp nhăn và nứt nẻ trên môi. Vitamin E giữ cho đôi môi của bạn được ẩm mịn. Chiết xuất quả tầm xuân chống oxy hóa, giảm nếp nhăn và nứt nẻ trên môi. Độ an toàn: Không chứa hương liệu Không paraben Bảo quản: Bảo quản nơi khô ráo, thoáng mát, tránh ánh nắng trực tiếp hoặc nơi có nhiệt độ cao / ẩm ướt. Tránh xa tầm tay trẻ em. Đậy nắp kín sau khi sử dụng. Thông số sản phẩm: Dung tích: 2ml Thương hiệu: Silkygirl Xuất xứ thương hiệu: Malaysia Sản xuất tại: Thái Lan Hạn sử dụng: 30 tháng kể từ ngày sản xuất Lưu ý: Tác dụng có thể khác nhau tuỳ cơ địa của người dùng Làm sao để phân biệt hàng có trộn hay không? Hàng trộn sẽ không thể xuất hoá đơn GTGT (VAT) 100% được do có hàng không nguồn gốc trong đó. Tại Hasaki, 100% hàng bán ra sẽ được xuất hoá đơn GTGT cho dù khách hàng có lấy hay không. Nếu có nhu cầu lấy hoá đơn GTGT, quý khách vui lòng cung cấp thông tin xuất hóa đơn trong vòng 2 giờ sau khi nhận hàng và trước 22h30 cùng ngày. 2 giờ sau khi giao hàng thành công, hệ thống Hasaki sẽ tự động xuất hết hoá đơn cho những hàng hoá mà khách hàng không đăng kí lấy hoá đơn. Do 100% hàng hóa bán ra đều được xuất hết hóa đơn GTGT trong ngày nên đảm bảo 100% hàng tại Hasaki là hàng chính hãng có nguồn gốc rõ ràng. Thu gọn",Chưa rõ,https://media.hcdn.vn/catalog/product/f/a/facebook-dynamic-422227980-1729561996_img_320x320_b04c1a_fit_center.jpg,141000,175000,19,5,0,Chưa có,Chưa có,165,AVAILABLE,2025-12-08 04:40:56.968+00,2025-12-08 04:40:56.945+00,2025-12-08 04:40:56.945+00,Other
a1423d7b-e7e7-46b3-84cd-9cc686567fc6,Son Tint Bóng Silkygirl 02 Sugar - Cam Đào 3g,Silkygirl,Tint Up! Lip Glass,"Son Tint Bóng Silkygirl Tint Up! Lip Glass là sản phẩm son tint đến từ thương hiệu mỹ phẩm Silkygirl của Malaysia, với chất son tint bóng mang màu sắc rực rỡ, cùng thành phần nhiều dưỡng chất giúp đôi môi căng mọng như thủy tinh, bền màu mà không hề bết dính. Son Tint Bóng Silkygirl Tint Up! Lip Glass 3g hiện đã có tại Hasaki với 5 màu: 01 Papaya – Cam San Hô 02 Sugar – Cam Đào 03 Berry – Hồng Đỏ 04 Melon – Hồng Dâu 05 Toffee – Đỏ Cam Đất Ưu thế nổi bật: Bộ sưu tập màu trendy, phù hợp với nhiều phong cách makeup khác nhau. Thiết kế hình trụ chắc chắn đi cùng thân son trong suốt có nhìn rõ màu son, hạn chế tối đa việc chất son tiếp xúc với không khí, tiện lợi bỏ vào túi khi đi học, đi làm hay đi du lịch. Kết cấu son tint bóng mịn, căng tràn mọng nước như thủy tinh, chất son nhẹ môi không gây cảm giác bết dính hay khó chịu . Son có độ bám màu cao, bạn có thể ăn uống thoải mái mà không sợ lem hay trôi. Chứa dưỡng chất giúp môi giữ nguyên độ căng bóng trong suốt thời gian dài, che phú rãnh môi và không làm khô môi. 3 tầng Hyaluronic Acid (HA) giúp cấp ẩm chuyên sâu. Chiết xuất từ Quả Táo giúp chống oxy hóa. Tocopheryl Acetate - một dạng Vitamin E tinh khiết giúp dưỡng môi mềm mịn suốt cả ngày. Bảo quản: Nơi khô ráo, thoáng mát, tránh ánh nắng trực tiếp. Đậy nắp kín sau khi sử dụng. Lưu ý để sản phẩm tránh xa tầm tay trẻ em. Thông số sản phẩm: Dung tích: 3g Thương hiệu: Silkygirl Xuất xứ thương hiệu: Malaysia Nơi sản xuất: Indonesia Lưu ý: Tác dụng có thể khác nhau tuỳ cơ địa của người dùng Làm sao để phân biệt hàng có trộn hay không? Hàng trộn sẽ không thể xuất hoá đơn GTGT (VAT) 100% được do có hàng không nguồn gốc trong đó. Tại Hasaki, 100% hàng bán ra sẽ được xuất hoá đơn GTGT cho dù khách hàng có lấy hay không. Nếu có nhu cầu lấy hoá đơn GTGT, quý khách vui lòng cung cấp thông tin xuất hóa đơn trong vòng 2 giờ sau khi nhận hàng và trước 22h30 cùng ngày. 2 giờ sau khi giao hàng thành công, hệ thống Hasaki sẽ tự động xuất hết hoá đơn cho những hàng hoá mà khách hàng không đăng kí lấy hoá đơn. Do 100% hàng hóa bán ra đều được xuất hết hóa đơn GTGT trong ngày nên đảm bảo 100% hàng tại Hasaki là hàng chính hãng có nguồn gốc rõ ràng. Thu gọn",Chưa rõ,https://media.hcdn.vn/catalog/product/p/r/promotions-auto-son-tint-bong-silkygirl-02-sugar-cam-dao-3g_uyQgRaodt13xoNqU_img_320x320_b04c1a_fit_center.png,147000,185000,21,5,0,Chưa có,Chưa có,190,AVAILABLE,2025-12-08 04:40:56.968+00,2025-12-08 04:40:56.945+00,2025-12-08 04:40:56.945+00,Other
ab38c530-f595-46fd-87db-a566d7f1d7f0,Son Kem Lì B.O.M #H BG 501 Vintage Brick - Đỏ Gạch 8.5g,B.O.M,Matt Holic Tint,"Son Kem Lì B.O.M Matt Holic Tint là sản phẩm son kem đến từ thương hiệu mỹ phẩm B.O.M của Hàn Quốc, với công thức son lì không bóng, không bết dính lên môi mịn mượt, nhẹ tựa như nhung cùng màu son rực rỡ, sống động. Ngoài ra, son kem lì B.O.M chứa tinh dầu nuôi dưỡng làn môi mềm mại, mịn màng, không gây khô môi hay tạo tình trạng rãnh môi. Chất son mịn mượt đến từ Son Kem Lì B.O.M Matt Holic Tint sẽ che phủ hoàn hảo những vết vân môi, tình trạng lộ rãnh môi đem đến cho bạn đôi môi mịn mượt, đầy hoàn hảo. Hiện Son Kem Lì B.O.M Matt Holic Tint chính hãng đã có mặt tại Hasaki, gồm có tone màu: H RD 101 Miss Cherry - Đỏ Cherry H RD 102 Vampire Red - Đỏ Rượu H RD 103 Maple Red - Đỏ Ánh Nâu H CR 201 Sugar Coral - Cam San Hô H RS 301 Lovely Rose- Hồng Tím H BG 501 Vintage Brick - Đỏ Gạch H BG 502 Sunset Brown - Cam Da H BG 503 Cinnamon Beige - Cam Da Đất Ưu thế nổi bật của Son Kem Lì B.O.M Matt Holic Tint: Công thức son lì không bết dính, lên môi mỏng nhẹ. Màu son lên môi nhanh chóng chỉ với 1 lần quẹt. Son có độ lâu trôi, bền màu trong nhiều giờ. Chứa tinh dầu dưỡng chất như: dầu nụ tầm xuân, dầu hạt mơ, dầu quả bơ, dầu hạt mắc-ca, vitamin E, ngọc trai nuôi dưỡng làn môi ẩm mịn, tràn đầy sức sống. Hướng dẫn bảo quản Son Kem Lì B.O.M Matt Holic Tint: Nơi khô ráo thoáng mát. Tránh ánh nắng trực tiếp, nơi có nhiệt độ cao hoặc ẩm ướt. Đậy nắp kín sau khi sử dụng. Làm sao để phân biệt hàng có trộn hay không? Hàng trộn sẽ không thể xuất hoá đơn GTGT (VAT) 100% được do có hàng không nguồn gốc trong đó. Tại Hasaki, 100% hàng bán ra sẽ được xuất hoá đơn GTGT cho dù khách hàng có lấy hay không. Nếu có nhu cầu lấy hoá đơn GTGT, quý khách vui lòng cung cấp thông tin xuất hóa đơn trong vòng 2 giờ sau khi nhận hàng và trước 22h30 cùng ngày. 2 giờ sau khi giao hàng thành công, hệ thống Hasaki sẽ tự động xuất hết hoá đơn cho những hàng hoá mà khách hàng không đăng kí lấy hoá đơn. Do 100% hàng hóa bán ra đều được xuất hết hóa đơn GTGT trong ngày nên đảm bảo 100% hàng tại Hasaki là hàng chính hãng có nguồn gốc rõ ràng. Thu gọn",Chưa rõ,https://media.hcdn.vn/catalog/product/f/a/facebook-dynamic-son-kem-li-b-o-m-h-bg-501-vintage-brick-1721272197_img_320x320_b04c1a_fit_center.jpg,278000,361000,23,5,0,Chưa có,Chưa có,21,AVAILABLE,2025-12-08 04:40:56.968+00,2025-12-08 04:40:56.945+00,2025-12-08 04:40:56.945+00,Other
9dd75fca-4892-4423-852c-e76d8598f478,Son Dưỡng Môi Nuxe Reve de Miel 4g,Nuxe,Reve de Miel Lip Moisturising Stick,"Son Dưỡng Môi Nuxe Reve de Miel Lip Moisturising Stick 4g là sản phẩm son dưỡng đến từ thương hiệu Nuxe - Pháp. Sản phẩm với mật ong và dầu hướng dương hữu cơ, làm mềm đôi môi rất khô và khiến chúng mềm mại hơn suốt cả ngày. Son Dưỡng Môi Nuxe Reve de Miel Lip Moisturising Stick 4g hiện đã có tại Hasaki. Loại da phù hợp: Mọi loại da môi, kể cả môi khô nhạy cảm. Ưu thế nổi bật: Chiết xuất dầu hướng dương hữu cơ & mật ong: giàu vitamin giúp cấp dưỡng ẩm, phục hồi thương tổn & chống oxy hóa. Dưỡng ẩm cho môi khô. Phục hồi các dấu hiệu hư tổn như môi khô, nứt, thiếu nước… Bảo vệ môi khỏi tác động của môi trường. Chăm sóc bờ môi mềm mại, tái tạo môi khỏe khoắn hơn. 100% thành phần có nguồn gốc tự nhiên. Bảo quản: Để xa tầm tay trẻ em. Không đặt ở những nơi có ánh sáng trực tiếp chiếu vào, hay những nơi có nhiệt độ quá cao. Đậy nắp kín sau khi sử dụng. Thông số sản phẩm: Dung tích: 4g Thương hiệu: Nuxe Xuất xứ thương hiệu: Pháp Nơi sản xuất: Pháp Lưu ý: Tác dụng có thể khác nhau tuỳ cơ địa của người dùng Làm sao để phân biệt hàng có trộn hay không? Hàng trộn sẽ không thể xuất hoá đơn GTGT (VAT) 100% được do có hàng không nguồn gốc trong đó. Tại Hasaki, 100% hàng bán ra sẽ được xuất hoá đơn GTGT cho dù khách hàng có lấy hay không. Nếu có nhu cầu lấy hoá đơn GTGT, quý khách vui lòng cung cấp thông tin xuất hóa đơn trong vòng 2 giờ sau khi nhận hàng và trước 22h30 cùng ngày. 2 giờ sau khi giao hàng thành công, hệ thống Hasaki sẽ tự động xuất hết hoá đơn cho những hàng hoá mà khách hàng không đăng kí lấy hoá đơn. Do 100% hàng hóa bán ra đều được xuất hết hóa đơn GTGT trong ngày nên đảm bảo 100% hàng tại Hasaki là hàng chính hãng có nguồn gốc rõ ràng. Thu gọn",Chưa rõ,https://media.hcdn.vn/catalog/product/f/a/facebook-dynamic-son-duong-moi-nuxe-reve-de-miel-4g-1726730730_img_320x320_b04c1a_fit_center.jpg,193000,220000,12,5,0,Chưa có,Chưa có,254,AVAILABLE,2025-12-08 04:40:56.968+00,2025-12-08 04:40:56.945+00,2025-12-08 04:40:56.945+00,Other
87decdb4-7d45-4195-bec7-9bd979f040a6,Son Kem Lì Nookoi Mềm Mịn Màu R26 Hồng Khói 4g,Nookoi,Blooming Moment Cream Tint - R26 Prima Begonia,"Son Kem Lì Nookoi Blooming Moment Cream Tint Mềm Mịn 4g là sản phẩm son kem đến từ thương hiệu Nookoi - Hàn Quốc. Sản phẩm lấy cảm hứng từ những đóa hoa nở rộ, dòng son Blooming Moment Cream Tint sẽ hô biến đôi môi trở nên mềm mại, cuốn hút hơn. Son Kem Lì Nookoi Blooming Moment Cream Tint 4g hiện đã có tại Hasaki gồm 6 tone màu: R21 Poppy Hi – Đỏ cam R22 Merry Marigold – Đỏ trầm R23 Zealous Zinnia – Cam sữa R24 Nudy Muhly – Hồng dâu R25 Woody Pampas – Cam nâu đất R26 Prima Begonia – Hồng khói Ưu thế nổi bật: Giúp đôi môi trở nên thu hút hơn với bảng màu phong phú, hiện đại. Màu sắc sau khi set sẽ chuẩn đậm. Không lem màu, không loang lổ, không bết dính. Bảo quản: Nơi khô ráo thoáng mát. Tránh ánh nắng trực tiếp, nơi có nhiệt độ cao hoặc ẩm ướt. Đậy nắp kín sau khi sử dụng. Thông số sản phẩm: Dung tích: 4g Thương hiệu: Nookoi Xuất xứ thương hiệu: Hàn Quốc Sản xuất tại: Hàn Quốc Lưu ý: Tác dụng có thể khác nhau tuỳ cơ địa của người dùng Làm sao để phân biệt hàng có trộn hay không? Hàng trộn sẽ không thể xuất hoá đơn GTGT (VAT) 100% được do có hàng không nguồn gốc trong đó. Tại Hasaki, 100% hàng bán ra sẽ được xuất hoá đơn GTGT cho dù khách hàng có lấy hay không. Nếu có nhu cầu lấy hoá đơn GTGT, quý khách vui lòng cung cấp thông tin xuất hóa đơn trong vòng 2 giờ sau khi nhận hàng và trước 22h30 cùng ngày. 2 giờ sau khi giao hàng thành công, hệ thống Hasaki sẽ tự động xuất hết hoá đơn cho những hàng hoá mà khách hàng không đăng kí lấy hoá đơn. Do 100% hàng hóa bán ra đều được xuất hết hóa đơn GTGT trong ngày nên đảm bảo 100% hàng tại Hasaki là hàng chính hãng có nguồn gốc rõ ràng. Thu gọn",Chưa rõ,https://media.hcdn.vn/catalog/product/f/a/facebook-dynamic-son-kem-li-nookoi-mem-min-mau-r26-hong-khoi-4g-1736936926_img_320x320_b04c1a_fit_center.jpg,157000,264000,41,5,0,Chưa có,Chưa có,281,AVAILABLE,2025-12-08 04:40:56.968+00,2025-12-08 04:40:56.945+00,2025-12-08 04:40:56.945+00,Other
7fc1297a-91bc-4afc-8173-d17e596ad716,"Combo 2 Son Dưỡng LipIce Hương Trà Sữa, Màu Hồng Cam Đất + Hương Trà Dâu - Màu Đỏ Cam 2.4g",LipIce,Sheer Color Q Milk Tea + Strawberry Tea,"Son Dưỡng LipIce Sheer Color Q là sản phẩm son dưỡng đến từ thương hiệu LipIce - Nhật Bản với thành phần Sáp ong thiên nhiên, Vitamin A, dầu Olive thiên nhiên kết hợp chiết xuất tự nhiên Shea Butter giúp làn môi của bạn được bảo vệ khỏi tác hại của ánh nắng (tia UV), đồng thời tạo sắc hồng tự nhiên cho đôi môi. Combo 2 Son Dưỡng LipIce Sheer Color Q 2.4g đã có tại Hasaki gồm 2 tone màu: LipIce Sheer Color Q Strawberry Tea Hương Trà Dâu - Màu Đỏ Cam: Tạo nét môi nổi bật với sắc đỏ cam rạng rỡ, thu hút. Cảm nhận hương Trà Dâu thanh ngọt, vương vấn trên môi. LipIce Sheer Color Q Milk Tea Hương Trà Sữa - Màu Hồng Cam Đất: Tạo nét môi ấn tượng với sắc hồng cam đất đầy cá tính. Cảm nhận hương Trà Sữa thân quen, không thể cưỡng lại. Ưu thế nổi bật: Lớp son trải nhẹ nhưng bám chặt, giữ màu môi thật lâu phai. Công thức dưỡng môi độc đáo, giữ ẩm dài lâu: Dầu Olive thiên nhiên kết hợp chiết xuất tự nhiên Shea Butter (Bơ hạt mỡ) làm mềm và giữ ẩm cho đôi môi trông khỏe khoắn và tươi tắn. Beeswax (Sáp ong thiên nhiên) chăm sóc, thổi sức sống mới cho đôi môi. Vitamin A & C giúp môi trông căng mọng, tươi trẻ hơn. Vitamin E giữ cho đôi môi luôn mềm mại, mịn màng. Dưỡng và bảo vệ môi mỗi ngày tránh các tác động: Thời tiết - Máy lạnh - Son trang điểm - Tia UV. Bảo quản: Nơi khô ráo thoáng mát. Thông số sản phẩm: Dung tích: 2.4gx2 Thương hiệu: LipIce Xuất xứ thương hiệu: Nhật Bản Nơi sản xuất: Việt Nam Lưu ý: Tác dụng có thể khác nhau tuỳ cơ địa của người dùng Làm sao để phân biệt hàng có trộn hay không? Hàng trộn sẽ không thể xuất hoá đơn GTGT (VAT) 100% được do có hàng không nguồn gốc trong đó. Tại Hasaki, 100% hàng bán ra sẽ được xuất hoá đơn GTGT cho dù khách hàng có lấy hay không. Nếu có nhu cầu lấy hoá đơn GTGT, quý khách vui lòng cung cấp thông tin xuất hóa đơn trong vòng 2 giờ sau khi nhận hàng và trước 22h30 cùng ngày. 2 giờ sau khi giao hàng thành công, hệ thống Hasaki sẽ tự động xuất hết hoá đơn cho những hàng hoá mà khách hàng không đăng kí lấy hoá đơn. Do 100% hàng hóa bán ra đều được xuất hết hóa đơn GTGT trong ngày nên đảm bảo 100% hàng tại Hasaki là hàng chính hãng có nguồn gốc rõ ràng. Thu gọn",Chưa rõ,https://media.hcdn.vn/catalog/product/f/a/facebook-dynamic-combo-2-son-duong-lipice-huong-tra-sua-mau-hong-cam-dat-huong-tra-dau-mau-do-cam-2-4g-1728631340_img_320x320_b04c1a_fit_center.jpg,138000,173000,20,5,0,Chưa có,Chưa có,283,AVAILABLE,2025-12-08 04:40:56.969+00,2025-12-08 04:40:56.945+00,2025-12-08 04:40:56.945+00,Other
dc9e3713-b98a-4a26-abf3-0c5d27f81095,Son Kem Lì Flawsome Mịn Nhẹ Xoxo - Hồng Đỏ Đất 3g,Flawsome,Chic Velvet Matte Tint,"Son Kem Lì Flawsome Chic Velvet Matte Tint Mịn Nhẹ 3g là sản phẩm son kem đến từ thương hiệu Flawsome - Nhật Bản. Sản phẩm lấy cảm hứng từ họa tiết răng sói (houndstooth) trứ danh của các thương hiệu thời trang đẳng cấp, BST FLAWSOME CHIC hứa hẹn mang đến 1 thiết kế độc đáo, hiện đại, thời thượng và không lỗi mốt. Son Kem Lì Flawsome Chic Velvet Matte Tint 3g hiện đã có tại Hasaki với 5 tone màu: Queendom - Đỏ Berry Trầm Xoxo - Hồng Đỏ Đất I Found U - Hồng Tro Trầm Be Mine - Nâu Cam Better Days - Cam Hồng Đất Ưu thế nổi bật: Dưỡng ẩm sâu và chống oxy hóa, cho đôi môi căng mọng nhờ chứa hỗn hợp 9 loại Berries. Chất son kem lì siêu nhẹ môi, mịn như nhung, lớp finish lì che phủ toàn bộ đôi môi và lên màu chuẩn sắc. Son kem lì phù hợp với phong cách trang điểm môi hiện đại, trẻ trung. Vỏ son lấy cảm hứng từ họa tiết răng sói (houndstooth) trứ danh của các thương hiệu thời trang đẳng cấp, mang đến 1 thiết kế độc đáo, hiện đại, thời thượng và không lỗi mốt. Bảo quản: Nơi khô ráo thoáng mát. Tránh ánh nắng trực tiếp, nơi có nhiệt độ cao hoặc ẩm ướt. Đậy nắp kín sau khi sử dụng. Thông số sản phẩm: Dung tích: 3g Thương hiệu: Flawsome Xuất xứ thương hiệu: Nhật Bản Sản xuất tại: Việt Nam Lưu ý: Tác dụng có thể khác nhau tuỳ cơ địa của người dùng Làm sao để phân biệt hàng có trộn hay không? Hàng trộn sẽ không thể xuất hoá đơn GTGT (VAT) 100% được do có hàng không nguồn gốc trong đó. Tại Hasaki, 100% hàng bán ra sẽ được xuất hoá đơn GTGT cho dù khách hàng có lấy hay không. Nếu có nhu cầu lấy hoá đơn GTGT, quý khách vui lòng cung cấp thông tin xuất hóa đơn trong vòng 2 giờ sau khi nhận hàng và trước 22h30 cùng ngày. 2 giờ sau khi giao hàng thành công, hệ thống Hasaki sẽ tự động xuất hết hoá đơn cho những hàng hoá mà khách hàng không đăng kí lấy hoá đơn. Do 100% hàng hóa bán ra đều được xuất hết hóa đơn GTGT trong ngày nên đảm bảo 100% hàng tại Hasaki là hàng chính hãng có nguồn gốc rõ ràng. Thu gọn",Chưa rõ,https://media.hcdn.vn/catalog/product/p/r/promotions-auto-son-kem-li-flawsome-min-nhe-xoxo-hong-do-dat-3g_648EtL1z2mNayTFW_img_320x320_b04c1a_fit_center.png,215000,269000,20,5,0,Chưa có,Chưa có,218,AVAILABLE,2025-12-08 04:40:56.969+00,2025-12-08 04:40:56.945+00,2025-12-08 04:40:56.945+00,Other
