product_id,name,brand,short_description,description,category,image,price_current,price_original,discount_percent,rating,reviews_count,monthly_sales,sell_progress,inventory_qty,status,status_updated_at,created_at,updated_at,catalog
d9c11512-9c7e-4a9b-8729-27c816ec922f,Son Thỏi Lì BYS Mịn Môi L341 Idolise - Hồng Đất 3.5g,BYS,Luxe Lips Ultra Matte Lipstick,"Son Thỏi Lì BYS Mịn Môi 3.5g là sản phẩm son thỏi đến từ thương hiệu mỹ phẩm thuần chay BYS của Úc. BYS Luxe Lips Ultra Matte Lipstick là dòng son thỏi mịn lì nổi bật với các thành phần thuần chay, chất son mỏng nhẹ mịn màng, tạo cảm giác lướt nhẹ trên môi một cách mượt mà, mà không gây bết dính. Hiện sản phẩm Son Thỏi Lì BYS Luxe Lips Ultra Matte Lipstick 3.5g đã có mặt tại Hasaki với 3 tông màu: L341 Idolise - Màu Hồng Đất L342 Queen Of The Night - Màu Đỏ Cherry L345 Bitter Sweet - Màu Cam Đất Ưu thế nổi bật: Chất son mềm, mượt, mịn không để lộ vân môi. Chứa chiết xuất giàu Vitamin E chống oxy hóa, giúp cho đôi môi luôn mềm mịn, hạn chế tình trạng khô nứt môi. Khả năng lên màu chuẩn chỉ sau 1 lần lướt nhẹ, độ bền màu cao, giữ màu tốt trong suốt nhiều giờ đồng hồ. Độ an toàn: Không chứa paraben, không chứa dầu khoáng. Đạt chuẩn thuần chay và an toàn Crueltyfree and Vegan. Bảo quản: Bảo quản nơi khô ráo, thoáng mát, tránh ánh nắng trực tiếp hoặc nơi có nhiệt độ cao / ẩm ướt. Tránh xa tầm tay trẻ em. Đậy nắp kín sau khi sử dụng. Thông số sản phẩm: Dung tích: 3.5g Thương hiệu: BYS Xuất xứ thương hiệu: Úc Sản xuất tại: Trung Quốc Hạn sử dụng: 3 năm kể từ ngày sản xuất Lưu ý: Tác dụng có thể khác nhau tuỳ cơ địa của người dùng Làm sao để phân biệt hàng có trộn hay không? Hàng trộn sẽ không thể xuất hoá đơn GTGT (VAT) 100% được do có hàng không nguồn gốc trong đó. Tại Hasaki, 100% hàng bán ra sẽ được xuất hoá đơn GTGT cho dù khách hàng có lấy hay không. Nếu có nhu cầu lấy hoá đơn GTGT, quý khách vui lòng cung cấp thông tin xuất hóa đơn trong vòng 2 giờ sau khi nhận hàng và trước 22h30 cùng ngày. 2 giờ sau khi giao hàng thành công, hệ thống Hasaki sẽ tự động xuất hết hoá đơn cho những hàng hoá mà khách hàng không đăng kí lấy hoá đơn. Do 100% hàng hóa bán ra đều được xuất hết hóa đơn GTGT trong ngày nên đảm bảo 100% hàng tại Hasaki là hàng chính hãng có nguồn gốc rõ ràng. Thu gọn",Chưa rõ,https://media.hcdn.vn/catalog/product/p/r/promotions-auto-son-thoi-li-bys-min-moi-l341-idolise-hong-dat-3-5g_BJkHZ6YQJNQ56Zrm_img_320x320_b04c1a_fit_center.png,144000,180000,20,5,0,Chưa có,Chưa có,259,AVAILABLE,2025-12-08 04:40:56.956+00,2025-12-08 04:40:56.945+00,2025-12-08 04:40:56.945+00,Other
55349f36-9244-438a-b5f9-3ac5b18b1f2f,Son Lì Naris Ailus Mịn Môi Màu 02 Đỏ Cam 4g,Naris Cosmetics,Stress Free Lipstick #02 Be Confident,"Son Lì Mịn Môi Naris Ailus Stress Free Lipstick 4g là dòng son môi đến từ thương hiệu Ailus thuộc Naris Cosmetics Nhật Bản. Không chỉ giúp tô điểm cho đôi môi thật nổi bật và quyến rũ chỉ sau một lần thoa, sản phẩm còn sở hữu công nghệ giải tỏa stress giúp tăng cường dưỡng ẩm và bảo vệ đôi môi trước ánh sáng xanh, mang lại hiệu quả lâu trôi lên đến 6 giờ. Hiện sản phẩm Son Lì Naris Ailus Stress Free Lipstick 4g chính hãng đã có tại Hasaki đang có 4 tông màu cho bạn lựa chọn: 01 Be Strong - Đỏ Thuần 02 Be Confident - Đỏ Cam 03 Be Brave - Cam 05 Be Yourself - Hồng Đào Ưu thế nổi bật của Son Lì Naris Ailus Stress Free Lipstick: Thành phần giàu dưỡng chất từ dầu Jojoba, mật ong, Hyaluronic Acid giúp dưỡng ẩm cho da môi mềm mịn, ngăn ngừa khô nẻ, bong tróc. Tinh chất Trà Xanh Nhật Bản với đặc tính chống oxy hóa giúp bảo vệ da môi khỏi tia UV. Công nghệ giải tỏa stress giúp tăng cường dưỡng ẩm và bảo vệ đôi môi trước ánh sáng xanh. Công nghệ Ultra ColorStay giúp màu son bền màu, giữ lâu trên môi đến 6 tiếng đồng hồ. Hướng dẫn bảo quản Son Lì Naris Ailus Stress Free Lipstick: Nơi khô ráo thoáng mát. Tránh ánh nắng trực tiếp, nơi có nhiệt độ cao hoặc ẩm ướt. Đậy nắp kín sau khi sử dụng. Lưu ý: Ngày sản xuất: Xem chi tiết trên bao bì. Hạn sử dụng: 05 năm kể từ ngày sản xuất. Lưu ý: Tác dụng có thể khác nhau tuỳ cơ địa của người dùng Làm sao để phân biệt hàng có trộn hay không? Hàng trộn sẽ không thể xuất hoá đơn GTGT (VAT) 100% được do có hàng không nguồn gốc trong đó. Tại Hasaki, 100% hàng bán ra sẽ được xuất hoá đơn GTGT cho dù khách hàng có lấy hay không. Nếu có nhu cầu lấy hoá đơn GTGT, quý khách vui lòng cung cấp thông tin xuất hóa đơn trong vòng 2 giờ sau khi nhận hàng và trước 22h30 cùng ngày. 2 giờ sau khi giao hàng thành công, hệ thống Hasaki sẽ tự động xuất hết hoá đơn cho những hàng hoá mà khách hàng không đăng kí lấy hoá đơn. Do 100% hàng hóa bán ra đều được xuất hết hóa đơn GTGT trong ngày nên đảm bảo 100% hàng tại Hasaki là hàng chính hãng có nguồn gốc rõ ràng. Thu gọn",Chưa rõ,https://media.hcdn.vn/catalog/product/f/a/facebook-dynamic-son-thoi-min-moi-naris-cosmetic-ailus-02-be-confident-4g-1749025595_img_320x320_b04c1a_fit_center.jpg,263000,329000,20,5,0,Chưa có,Chưa có,269,AVAILABLE,2025-12-08 04:40:56.957+00,2025-12-08 04:40:56.945+00,2025-12-08 04:40:56.945+00,Other
6a127086-a480-4ad9-8a22-1fd8e56cb37f,Son Kem Lì Australis Mịn Môi Casual - Màu Đỏ Thuần 4g,australis,Lip Blur,"Son Kem Lì Australis Lip Blur 4g là sản phẩm son kem của thương hiệu mỹ phẩm nổi tiếng Australis - Úc. Sản phẩm chiết xuất dầu Jojoba, giàu Vitamin E, Vitamin A, chất chống oxy hóa, giúp cho môi căng mọng, tràn đầy sức sống. Son Kem Lì Australis Lip Blur 4g chính hãng hiện đã có tại Hasaki gồm 6 màu: Casual – Màu đỏ thuần Cushion – Màu cam cháy Dreamy – Màu hồng sen Haze – Màu cam đất Whipped – Màu đỏ cherry Breezy - Màu Cam Ưu thế nổi bật của Son Kem Lì Australis Lip Blur: Chứa chiết xuất dầu Jojoba, giàu Vitamin E, Vitamin A chất chống oxy hóa giúp cho môi căng mọng, tràn đầy sức sống. Phù hợp với mọi khách hàng, đặc biệt là các khách hàng phun môi, môi khô nứt nẻ. Hyaluronic Acid giúp dưỡng ẩm làm mịn môi. Thành phần giữ độ bền của màu cho son lâu trôi, khi ăn dầu mỡ vẫn để lại lớp base trên môi. Hướng dẫn bảo quản Son Kem Lì Australis Lip Blur: Nơi khô ráo thoáng mát. Tránh ánh nắng trực tiếp, nơi có nhiệt độ cao hoặc ẩm ướt. Đậy nắp kín sau khi sử dụng. Lưu ý: Ngày sản xuất: Xem chi tiết trên bao bì. Hạn sử dụng: 05 năm kể từ ngày sản xuất. Lưu ý: Tác dụng có thể khác nhau tuỳ cơ địa của người dùng Làm sao để phân biệt hàng có trộn hay không? Hàng trộn sẽ không thể xuất hoá đơn GTGT (VAT) 100% được do có hàng không nguồn gốc trong đó. Tại Hasaki, 100% hàng bán ra sẽ được xuất hoá đơn GTGT cho dù khách hàng có lấy hay không. Nếu có nhu cầu lấy hoá đơn GTGT, quý khách vui lòng cung cấp thông tin xuất hóa đơn trong vòng 2 giờ sau khi nhận hàng và trước 22h30 cùng ngày. 2 giờ sau khi giao hàng thành công, hệ thống Hasaki sẽ tự động xuất hết hoá đơn cho những hàng hoá mà khách hàng không đăng kí lấy hoá đơn. Do 100% hàng hóa bán ra đều được xuất hết hóa đơn GTGT trong ngày nên đảm bảo 100% hàng tại Hasaki là hàng chính hãng có nguồn gốc rõ ràng. Thu gọn",Chưa rõ,https://media.hcdn.vn/catalog/product/f/a/facebook-dynamic-son-kem-li-australis-min-moi-casual-mau-do-thuan-4g-1729051322_img_320x320_b04c1a_fit_center.jpg,239000,300000,20,5,0,Chưa có,Chưa có,268,AVAILABLE,2025-12-08 04:40:56.966+00,2025-12-08 04:40:56.945+00,2025-12-08 04:40:56.945+00,Other
a5cf50d7-54e7-4d9b-ae92-dbc311d791be,Son Kem Lì Judydoll Đầu Bông - N01 Cam Đào 1.8g,Judydoll,Cushion Lip Powder Cream,"Son Kem Lì Judydoll Đầu Bông Cushion Lip Powder Cream là sản phẩm son kem lì đến từ thương hiệu Judydoll - Trung Quốc với công nghệ ""Peptide kép mờ vân môi"" giúp đôi môi căng mọng, che đi vân môi nhưng vẫn cung cấp đủ độ ẩm, không gây khô môi. Chất son nhung mịn mỏng nhẹ, không dây ra ly cốc, bền màu đến 12h. Hiện sản phẩm Son Kem Lì Judydoll Cushion Lip Powder Cream 1.8g đã có mặt tại Hasaki với 4 tông màu: N01 Cam Đào N03 Đỏ Gạch N04 Đỏ Lựu N05 Hồng Đất Ưu thế nổi bật: Peptide dưỡng ẩm kết hợp cùng tinh dầu chiết xuất từ 3 loại thực vật giúp đôi môi căng mọng đầy đặn, vân môi mờ đi tự nhiên. Chất son bột mỏng nhẹ. Khi son set lại sẽ lên hiệu ứng che khuyết điểm rãnh môi nhưng không gây khô môi. Thiết kế son dạng vặn lạ mắt, đầu bông tán son đi kèm tiện lợi. Có thể tận dụng son như má hồng, phấn mắt,.. để mang đến một makeup đồng bộ và nhanh chóng, tiết kiệm thời gian. Bảo quản: Nơi khô ráo thoáng mát. Tránh ánh nắng trực tiếp, nơi có nhiệt độ cao hoặc ẩm ướt. Đậy nắp kín sau khi sử dụng. Thông số sản phẩm: Dung tích: 1.8g Thương hiệu: Judydoll Xuất xứ thương hiệu: Trung Quốc Sản xuất tại: Trung Quốc Lưu ý: Tác dụng có thể khác nhau tuỳ cơ địa của người dùng Làm sao để phân biệt hàng có trộn hay không? Hàng trộn sẽ không thể xuất hoá đơn GTGT (VAT) 100% được do có hàng không nguồn gốc trong đó. Tại Hasaki, 100% hàng bán ra sẽ được xuất hoá đơn GTGT cho dù khách hàng có lấy hay không. Nếu có nhu cầu lấy hoá đơn GTGT, quý khách vui lòng cung cấp thông tin xuất hóa đơn trong vòng 2 giờ sau khi nhận hàng và trước 22h30 cùng ngày. 2 giờ sau khi giao hàng thành công, hệ thống Hasaki sẽ tự động xuất hết hoá đơn cho những hàng hoá mà khách hàng không đăng kí lấy hoá đơn. Do 100% hàng hóa bán ra đều được xuất hết hóa đơn GTGT trong ngày nên đảm bảo 100% hàng tại Hasaki là hàng chính hãng có nguồn gốc rõ ràng. Thu gọn",Chưa rõ,https://media.hcdn.vn/catalog/product/f/a/facebook-dynamic-son-kem-li-judydoll-dau-bong-n01-cam-dao-1-8g-1727424430_img_320x320_b04c1a_fit_center.jpg,88000,208000,58,5,0,Chưa có,Chưa có,104,AVAILABLE,2025-12-08 04:40:56.957+00,2025-12-08 04:40:56.945+00,2025-12-08 04:40:56.945+00,Other
f69486de-3d25-42e6-b2ae-a28eb57b086b,Son Tint 3CE Lâu Trôi Màu Tan - Đỏ Nâu Gạch 4.5g,3CE,Lazy Pop Lip Stain,"Son Tint 3CE Lâu Trôi Lazy Pop Lip Stain là sản phẩm son tint đến từ thương hiệu 3CE - Hàn Quốc, sở hữu kết cấu mỏng nhẹ như nước, dễ dàng lướt trên môi, mang lại cảm giác ẩm mượt và thoải mái ngay từ lần sử dụng đầu tiên. Nhờ ứng dụng công nghệ dầu dừa trong nước, Lazy Pop Lip Stain giúp duy trì độ ẩm cho môi mà không gây nặng hay bết dính. Đặc biệt, khả năng lên màu chuẩn xác chỉ sau một lần thoa, kết hợp với công thức chống nước, lâu trôi giúp màu son luôn giữ được sự tươi tắn và sắc nét trong nhiều giờ liền. Son Tint 3CE Lazy Pop Lip Stain 4.5g hiện đã có tại Hasaki với 5 tông màu: Luztic - Đỏ Cherry Spiced Up - Hồng Mận Yay Or Nay - Đỏ Cam Coolest - Đỏ Hồng Tan - Đỏ Nâu Gạch Ưu thế nổi bật của Son Tint 3CE Lazy Pop Lip Stain: Chất son tint mỏng nhẹ như nước: Lướt mượt trên môi, không gây nặng hay bết dính. Công thức dầu dừa trong nước: Cấp ẩm hiệu quả, giữ môi mềm mượt suốt cả ngày. Màu sắc rõ nét, nổi bật: Bảng màu dễ ứng dụng, phù hợp nhiều tông da. Độ bền màu cao, lâu trôi, chống nước tốt: Giữ màu đẹp suốt cả ngày mà không cần dặm lại. Lên màu chuẩn ngay từ lần quệt đầu tiên, không cần thoa nhiều lớp. Hiệu ứng hoàn thiện rạng rỡ, giúp đôi môi luôn tươi tắn, chỉn chu mọi lúc. Hướng dẫn bảo quản Son Tint 3CE Lazy Pop Lip Stain: Nơi khô ráo thoáng mát. Tránh ánh nắng trực tiếp, nơi có nhiệt độ cao hoặc ẩm ướt. Đậy nắp kín sau khi sử dụng. Lưu ý: Ngày sản xuất: Xem trên bao bì. Hạn sử dụng: 36 tháng kể từ ngày sản xuất. Lưu ý: Tác dụng có thể khác nhau tuỳ cơ địa của người dùng Làm sao để phân biệt hàng có trộn hay không? Hàng trộn sẽ không thể xuất hoá đơn GTGT (VAT) 100% được do có hàng không nguồn gốc trong đó. Tại Hasaki, 100% hàng bán ra sẽ được xuất hoá đơn GTGT cho dù khách hàng có lấy hay không. Nếu có nhu cầu lấy hoá đơn GTGT, quý khách vui lòng cung cấp thông tin xuất hóa đơn trong vòng 2 giờ sau khi nhận hàng và trước 22h30 cùng ngày. 2 giờ sau khi giao hàng thành công, hệ thống Hasaki sẽ tự động xuất hết hoá đơn cho những hàng hoá mà khách hàng không đăng kí lấy hoá đơn. Do 100% hàng hóa bán ra đều được xuất hết hóa đơn GTGT trong ngày nên đảm bảo 100% hàng tại Hasaki là hàng chính hãng có nguồn gốc rõ ràng. Thu gọn",Chưa rõ,https://media.hcdn.vn/catalog/product/f/a/facebook-dynamic-son-tint-3ce-lau-troi-mau-tan-do-nau-gach-4-5g-1720146741_img_320x320_b04c1a_fit_center.jpg,266000,388000,31,5,0,Chưa có,Chưa có,103,AVAILABLE,2025-12-08 04:40:56.957+00,2025-12-08 04:40:56.945+00,2025-12-08 04:40:56.945+00,Other
2e587a68-3fb9-4d80-8514-9201083cf532,Son Lì B.O.M #808 My Warm Red - Đỏ Đất 3.5g,B.O.M,My Lipstick,"Son Lì B.O.M My Lipstick 3.5g đến từ thương hiệu B.O.M Cosmetics của Hàn Quốc là bộ sưu tập son MLBB vô cùng trendy - với 10 sắc son xu hướng từ màu nude tự nhiên đến đỏ cổ điển, cùng chất son mịn lì như nhung, đem đến cho bạn bờ môi đẹp chuẩn sắc. Thành phần son giàu các dưỡng chất tự nhiên từ Vitamin E và 4 loại dầu thực vật (Macca, quả bơ, hạt mơ, nụ tầm xuân) giúp bảo vệ và dưỡng ẩm cho đôi môi luôn mềm mịn, không khô tróc. Hiện Son Lì B.O.M My Lipstick 3.5g đã có mặt tại Hasaki với các tone màu như sau: 801 My Red - Đỏ Thuần 802 My Cherry Red - Đỏ Cherry 803 My Orange - Đỏ Cam 804 My Coral - Đỏ San Hô 805 My Light Coral - Hồng San Hô 806 My Rose - Hồng Đất 807 My Deep Red - Đỏ Lạnh 808 My Warm Red - Đỏ Đất 809 My Chily Red - Đỏ Nâu 810 My Brick Red - Đỏ Gạch 811 My Fancy Red - Đỏ Rượu Ưu thế nổi bật: Màu sắc thời thượng, lên màu chuẩn với công nghệ Color Printing mới cho màu sắc tươi tắn, bám tự nhiên trên môi. Khả năng che phủ hoàn hảo, mịn mượt không làm lộ vân môi. Son hiệu ứng lì nhưng cho cảm giác môi được dưỡng ẩm, cho đôi môi mịn màng như lụa, không khô căng bong tróc. Màu lên chuẩn sắc rõ ràng chỉ với một lần đánh, đặc biệt có thể điều chỉnh tone màu đậm nhạt tùy ý khi tô thêm nhiều lớp. Phiên bản nâng cấp nay đã có thêm dưỡng chất, đồng thời son lâu trôi màu hơn. Vỏ son nam châm giúp hạn chế việc rơi nắp cũng như ngăn chặn việc son bị khô / bị chảy mồ hôi do ảnh hưởng của nhiệt độ. Bảo quản: Tránh ánh nắng trực tiếp. Để nơi khô ráo, thoáng mát. Đậy nắp kín sau khi sử dụng. Thông số sản phẩm: Dung tích: 3.5g Thương hiệu: B.O.M Xuất xứ thương hiệu: Hàn Quốc Sản xuất tại: Hàn Quốc Lưu ý: Tác dụng có thể khác nhau tuỳ cơ địa của người dùng Làm sao để phân biệt hàng có trộn hay không? Hàng trộn sẽ không thể xuất hoá đơn GTGT (VAT) 100% được do có hàng không nguồn gốc trong đó. Tại Hasaki, 100% hàng bán ra sẽ được xuất hoá đơn GTGT cho dù khách hàng có lấy hay không. Nếu có nhu cầu lấy hoá đơn GTGT, quý khách vui lòng cung cấp thông tin xuất hóa đơn trong vòng 2 giờ sau khi nhận hàng và trước 22h30 cùng ngày. 2 giờ sau khi giao hàng thành công, hệ thống Hasaki sẽ tự động xuất hết hoá đơn cho những hàng hoá mà khách hàng không đăng kí lấy hoá đơn. Do 100% hàng hóa bán ra đều được xuất hết hóa đơn GTGT trong ngày nên đảm bảo 100% hàng tại Hasaki là hàng chính hãng có nguồn gốc rõ ràng. Thu gọn",Chưa rõ,https://media.hcdn.vn/catalog/product/f/a/facebook-dynamic-son-li-b-o-m-my-lipstick-808-my-warm-red-3-5g-1740472677_img_320x320_b04c1a_fit_center.jpg,272000,342000,20,5,0,Chưa có,Chưa có,135,AVAILABLE,2025-12-08 04:40:56.957+00,2025-12-08 04:40:56.945+00,2025-12-08 04:40:56.945+00,Other
f23a02cc-d5c7-41e9-9dbf-7e93525deb75,Son Kem Lì B.O.M #H RD 102 Vampire Red - Đỏ Rượu 8.5g,B.O.M,Matt Holic Tint,"Son Kem Lì B.O.M Matt Holic Tint là sản phẩm son kem đến từ thương hiệu mỹ phẩm B.O.M của Hàn Quốc, với công thức son lì không bóng, không bết dính lên môi mịn mượt, nhẹ tựa như nhung cùng màu son rực rỡ, sống động. Ngoài ra, son kem lì B.O.M chứa tinh dầu nuôi dưỡng làn môi mềm mại, mịn màng, không gây khô môi hay tạo tình trạng rãnh môi. Chất son mịn mượt đến từ Son Kem Lì B.O.M Matt Holic Tint sẽ che phủ hoàn hảo những vết vân môi, tình trạng lộ rãnh môi đem đến cho bạn đôi môi mịn mượt, đầy hoàn hảo. Hiện Son Kem Lì B.O.M Matt Holic Tint chính hãng đã có mặt tại Hasaki, gồm có tone màu: H RD 101 Miss Cherry - Đỏ Cherry H RD 102 Vampire Red - Đỏ Rượu H RD 103 Maple Red - Đỏ Ánh Nâu H CR 201 Sugar Coral - Cam San Hô H RS 301 Lovely Rose- Hồng Tím H BG 501 Vintage Brick - Đỏ Gạch H BG 502 Sunset Brown - Cam Da H BG 503 Cinnamon Beige - Cam Da Đất Ưu thế nổi bật của Son Kem Lì B.O.M Matt Holic Tint: Công thức son lì không bết dính, lên môi mỏng nhẹ. Màu son lên môi nhanh chóng chỉ với 1 lần quẹt. Son có độ lâu trôi, bền màu trong nhiều giờ. Chứa tinh dầu dưỡng chất như: dầu nụ tầm xuân, dầu hạt mơ, dầu quả bơ, dầu hạt mắc-ca, vitamin E, ngọc trai nuôi dưỡng làn môi ẩm mịn, tràn đầy sức sống. Hướng dẫn bảo quản Son Kem Lì B.O.M Matt Holic Tint: Nơi khô ráo thoáng mát. Tránh ánh nắng trực tiếp, nơi có nhiệt độ cao hoặc ẩm ướt. Đậy nắp kín sau khi sử dụng. Làm sao để phân biệt hàng có trộn hay không? Hàng trộn sẽ không thể xuất hoá đơn GTGT (VAT) 100% được do có hàng không nguồn gốc trong đó. Tại Hasaki, 100% hàng bán ra sẽ được xuất hoá đơn GTGT cho dù khách hàng có lấy hay không. Nếu có nhu cầu lấy hoá đơn GTGT, quý khách vui lòng cung cấp thông tin xuất hóa đơn trong vòng 2 giờ sau khi nhận hàng và trước 22h30 cùng ngày. 2 giờ sau khi giao hàng thành công, hệ thống Hasaki sẽ tự động xuất hết hoá đơn cho những hàng hoá mà khách hàng không đăng kí lấy hoá đơn. Do 100% hàng hóa bán ra đều được xuất hết hóa đơn GTGT trong ngày nên đảm bảo 100% hàng tại Hasaki là hàng chính hãng có nguồn gốc rõ ràng. Thu gọn",Chưa rõ,https://media.hcdn.vn/catalog/product/f/a/facebook-dynamic-son-kem-li-b-o-m-h-rd-h-rd-102-vampire-red-1721271997_img_320x320_b04c1a_fit_center.jpg,306000,361000,15,5,0,Chưa có,Chưa có,223,AVAILABLE,2025-12-08 04:40:56.96+00,2025-12-08 04:40:56.945+00,2025-12-08 04:40:56.945+00,Other
ac00bfb3-d5b8-4451-98f2-c3d6f882d937,Nước Tẩy Trang Mắt Môi Silkygirl 55ml,Silkygirl,Gentle Eye & Lip,"Nước Tẩy Trang Mắt, Môi Silkygirl Gentle Eye & Lip là sản phẩm tẩy trang mắt đến từ thương hiệu mỹ phẩm Silkygirl của Malaysia, tích hợp 2 trong 1 với kết cấu dung dịch dạng lỏng vừa có thể tẩy trang cho mắt, vừa có thể tẩy trang cho môi một cách thuận tiện và hiệu quả. Hiện sản phẩm Nước Tẩy Trang Mắt, Môi Silkygirl Gentle Eye & Lip đã có mặt tại Hasaki với các loại: 55ml 110ml Loại da phù hợp: Sản phẩm thích hợp với mọi loại da, kể cả da nhạy cảm. Ưu thế nổi bật: Được thiết kế chuyên dụng để tẩy trang cho cả mắt và môi. Giúp nhẹ nhàng làm sạch bụi bẩn, dầu nhờn cùng lớp trang điểm trên mắt và môi. Nước tẩy trang dịu nhẹ cho da và không để lại lượng dầu dư khi tẩy trang. Bảo quản: Nơi khô ráo, thoáng mát. Tránh ánh nắng trực tiếp, nơi có nhiệt độ cao hoặc ẩm ướt. Đậy nắp kín sau khi sử dụng. Thông số sản phẩm: Dung tích: 55ml, 110ml Thương hiệu: Silkygirl Xuất xứ thương hiệu: Malaysia Sản xuất tại: Malaysia. Làm sao để phân biệt hàng có trộn hay không? Hàng trộn sẽ không thể xuất hoá đơn GTGT (VAT) 100% được do có hàng không nguồn gốc trong đó. Tại Hasaki, 100% hàng bán ra sẽ được xuất hoá đơn GTGT cho dù khách hàng có lấy hay không. Nếu có nhu cầu lấy hoá đơn GTGT, quý khách vui lòng cung cấp thông tin xuất hóa đơn trong vòng 2 giờ sau khi nhận hàng và trước 22h30 cùng ngày. 2 giờ sau khi giao hàng thành công, hệ thống Hasaki sẽ tự động xuất hết hoá đơn cho những hàng hoá mà khách hàng không đăng kí lấy hoá đơn. Do 100% hàng hóa bán ra đều được xuất hết hóa đơn GTGT trong ngày nên đảm bảo 100% hàng tại Hasaki là hàng chính hãng có nguồn gốc rõ ràng. Thu gọn",Chưa rõ,https://media.hcdn.vn/catalog/product/p/r/promotions-auto-nuoc-tay-trang-mat-moi-silkygirl-55ml_zMySzVXVRGjxAYkA_img_320x320_b04c1a_fit_center.png,92000,116000,21,5,0,Chưa có,Chưa có,193,AVAILABLE,2025-12-08 04:40:56.962+00,2025-12-08 04:40:56.945+00,2025-12-08 04:40:56.945+00,Other
