product_id,name,brand,short_description,description,category,image,price_current,price_original,discount_percent,rating,reviews_count,monthly_sales,sell_progress,inventory_qty,status,status_updated_at,created_at,updated_at,catalog
06a29fb5-b55f-4f44-8655-ea394d06936c,Son Tint Black Rouge DL08 Apricot Nudism - Be Da 4.1g,Black Rouge,Double Layer Over Velvet Season 2 Gallery,"Son Tint Black Rouge Double Layer Over Velvet Season 2 Gallery 4.1g là sản phẩm son tint đến từ thương hiệu mỹ phẩm Black Rouge của Hàn Quốc. Tiếp nối sự thành công của BST Double Layer Over Velvet - Signature, Black Rouge đã trở lại với BST Double Layer Over Velvet Version 2 - Gallery với 8 sắc son mang phong cách và thần thái khác biệt. BST Gallery với thiết kế đơn sắc cùng điểm nhấn ánh tím khói thể hiện sự tinh tế, hiện đại và đầy cá tính, hệt như một tác phẩm nghệ thuật. Hiện sản phẩm Son Tint Black Rouge Double Layer Over Velvet Season 2 Gallery 4.1g đã có mặt tại Hasaki với 8 màu son: DL07 Fauvism Red: Màu cam đỏ tươi đầy sức sống và tràn đầy năng lượng DL08 Apricot Nudism: Màu be nude mềm mại như quả mơ chín mọng DL09 Modern Orange: Màu Ánh cam khói dịu dàng tựa ánh nắng ngày xuân ấm áp DL10 Romantic Pink: Sắc hồng rose như nở rộ trong không khí se lạnh DL11 Dada Chilli: Sắc đỏ táo phù hợp với mọi loại da với sắc đỏ thuần khiết đến 99,9% DL12 Cubism Brick: Màu gạch trung tính pha chút ánh cam ấm áp DL13 Gothic Jujube: Màu đỏ gạch đầy mê hoặc cùng chút ánh đỏ sẫm của tương ớt Hàn Quốc DL14 Maximal Brown: Tông màu nâu gạch điểm thêm chút ánh nắng mai Ưu thế nổi bật: Thiết kế: Thiết kế bắt mắt với tông màu tím pastel pha chút ánh xám nhạt độc quyền của Black Rouge. Điểm nhấn nằm ở phần logo được khắc chìm trên thân son giúp thấy được màu son bên trong. Nhỏ gọn, tiện lợi khi mang đi làm, đi học hoặc đi du lịch. Công dụng: Velvet Fit: Chất velvet ẩm mượt, nhẹ môi với kết cấu nhung lì tăng cường cảm giác mịn mướt và khả năng lên màu cực chuẩn giúp màu sắc tự nhiên, sinh động. Film Over: Lớp màng mỏng bao phủ phía trên, giúp son không bị lem hay trôi trong thời gian dài, giữ được màu sắc nguyên vẹn. Độ bền màu và độ lì của son tốt khi màu sắc của son vẫn được giữ nguyên ngay cả khi đã thoa son được một thời gian dài. Lip treatment: Bổ sung các thành phần dinh dưỡng và dưỡng ẩm giúp môi không bị bong tróc. Bảo quản: Nơi khô ráo thoáng mát. Tránh ánh nắng trực tiếp, nơi có nhiệt độ cao hoặc ẩm ướt. Đậy nắp kín sau khi sử dụng. Thông số sản phẩm: Dung tích: 4.1g Thương hiệu: Black Rouge Xuất xứ thương hiệu: Hàn Quốc Sản xuất tại: Hàn Quốc. Lưu ý: Tác dụng có thể khác nhau tuỳ cơ địa của người dùng Làm sao để phân biệt hàng có trộn hay không? Hàng trộn sẽ không thể xuất hoá đơn GTGT (VAT) 100% được do có hàng không nguồn gốc trong đó. Tại Hasaki, 100% hàng bán ra sẽ được xuất hoá đơn GTGT cho dù khách hàng có lấy hay không. Nếu có nhu cầu lấy hoá đơn GTGT, quý khách vui lòng cung cấp thông tin xuất hóa đơn trong vòng 2 giờ sau khi nhận hàng và trước 22h30 cùng ngày. 2 giờ sau khi giao hàng thành công, hệ thống Hasaki sẽ tự động xuất hết hoá đơn cho những hàng hoá mà khách hàng không đăng kí lấy hoá đơn. Do 100% hàng hóa bán ra đều được xuất hết hóa đơn GTGT trong ngày nên đảm bảo 100% hàng tại Hasaki là hàng chính hãng có nguồn gốc rõ ràng. Thu gọn",Chưa rõ,https://media.hcdn.vn/catalog/product/f/a/facebook-dynamic-son-tint-black-rouge-dl08-apricot-nudism-mau-be-nude-4-1g-1721292198_img_320x320_b04c1a_fit_center.jpg,185000,318000,42,5,0,Chưa có,Chưa có,271,AVAILABLE,2025-12-08 04:40:56.974+00,2025-12-08 04:40:56.945+00,2025-12-08 04:40:56.945+00,Other
978255a6-8c75-4fc6-a904-804ec27be43e,[HSD 05/2026] Son Kem Lì 2In1 Silkygirl 04 Pepper Love Màu Đỏ Cherry 3.8ml,Silkygirl,Lip 2 Cheek Flush,"Nội dung đang được cập nhật Làm sao để phân biệt hàng có trộn hay không? Hàng trộn sẽ không thể xuất hoá đơn GTGT (VAT) 100% được do có hàng không nguồn gốc trong đó. Tại Hasaki, 100% hàng bán ra sẽ được xuất hoá đơn GTGT cho dù khách hàng có lấy hay không. Nếu có nhu cầu lấy hoá đơn GTGT, quý khách vui lòng cung cấp thông tin xuất hóa đơn trong vòng 2 giờ sau khi nhận hàng và trước 22h30 cùng ngày. 2 giờ sau khi giao hàng thành công, hệ thống Hasaki sẽ tự động xuất hết hoá đơn cho những hàng hoá mà khách hàng không đăng kí lấy hoá đơn. Do 100% hàng hóa bán ra đều được xuất hết hóa đơn GTGT trong ngày nên đảm bảo 100% hàng tại Hasaki là hàng chính hãng có nguồn gốc rõ ràng.",Chưa rõ,https://media.hcdn.vn/catalog/product/g/o/google-shopping-son-kem-li-2in1-silkygirl-04-pepper-love-mau-do-cherry-38ml-1721358279-1748848640_img_320x320_b04c1a_fit_center.jpg,56000,178000,69,5,0,Chưa có,Chưa có,293,AVAILABLE,2025-12-08 04:40:56.974+00,2025-12-08 04:40:56.945+00,2025-12-08 04:40:56.945+00,Other
5cc6f248-00ff-4528-a325-1ebd742d12ec,Son Kem Maybelline Mịn Lì Như Nhung CM17 Hạt Dẻ 6.4ml,Maybelline,Sensational Cushion Mattes #CM17 Chestnut On The Point,"Son Kem Maybelline Mịn Lì Như Nhung 6.4ml là sản phẩm son kem đến từ thương hiệu mỹ phẩm nổi tiếng Maybelline New York, với cảm hứng từ cushion Maybelline cho ra đời dòng son Sensational Cushion Matte với kết cấu mềm mại, mịn lì như nhung. Đặc biệt, sử dụng công nghệ đột phá Hiệu ứng lì đa chiều - dimensional matte, tạo không gian nhiều sắc độ, chiều sâu, hút trọn sắc son rồi bung ra ôm ấp lấy bờ môi xinh xắn của người châu Á. Hiện sản phẩm Son Kem Maybelline Sensational Cushion Matte 6.4ml đã có mặt tại Hasaki với các tone màu: Bảng màu thời thượng, dễ dùng cho mọi cô gái: CM01 - The Devil Wears Red: Đỏ Hồng Cherry CM06 - Urban Spice: Gạch đun CM07 - Lips On Pulse: Hồng ngọt nắng CM08 - Girl Who Rules: Vang đỏ CM09 - Red Lips Society: Mứt cà chua (Mới) CM10 - The Cool Rebel: Hồng trà sữa CM11 - Love Drunk: Chu Sa (Mới) BST Nudie: tông màu mới CM12 - Don't Be Rude: Cam Ngọt (Mới) CM14 - Sunset Affair: Hồng Đất CM17 - Chestnut On The Point: Hạt Dẻ Ưu thế nổi bật: Mới tô sẽ có hiệu ứng căng mọng môi sau đó nhờ công nghệ lì đa chiều giúp đem đến hiệu ứng lớp nhung mịn lì trên môi. Vitamin E dưỡng ẩm môi mềm mịn, có thể layer nhiều lớp nhưng không gây khô môi. Độ lì tương đối, không để lại hiện tượng bột đồng thời làm mờ rãnh môi hiệu quả. Để lại lớp base nhẹ nhàng trên môi, giúp bạn luôn tươi tắn trong mọi khoảnh khắc. Bảng màu son đa dạng, thời thượng cho mọi cô gái. Thiết kế thỏi son vuông vắn, nhỏ gọn tiện lợi bỏ vô túi hay đi du lịch. Bảo quản: Nơi khô ráo thoáng mát. Tránh ánh nắng trực tiếp, nơi có nhiệt độ cao hoặc ẩm ướt. Đậy nắp kín sau khi sử dụng. Dung tích: 6.4ml Thương hiệu: Maybelline Xuất xứ thương hiệu: Mỹ Sản xuất tại: Trung Quốc. Lưu ý: Maybelline New York được sản xuất tại nhiều nhà máy trên toàn thế giới như Trung Quốc, Mỹ, Indonesia… Tất cả các sản phẩm đều tuân theo quy trình kiểm soát chất lượng nghiêm ngặt và đồng đều của Maybelline toàn cầu. Làm sao để phân biệt hàng có trộn hay không? Hàng trộn sẽ không thể xuất hoá đơn GTGT (VAT) 100% được do có hàng không nguồn gốc trong đó. Tại Hasaki, 100% hàng bán ra sẽ được xuất hoá đơn GTGT cho dù khách hàng có lấy hay không. Nếu có nhu cầu lấy hoá đơn GTGT, quý khách vui lòng cung cấp thông tin xuất hóa đơn trong vòng 2 giờ sau khi nhận hàng và trước 22h30 cùng ngày. 2 giờ sau khi giao hàng thành công, hệ thống Hasaki sẽ tự động xuất hết hoá đơn cho những hàng hoá mà khách hàng không đăng kí lấy hoá đơn. Do 100% hàng hóa bán ra đều được xuất hết hóa đơn GTGT trong ngày nên đảm bảo 100% hàng tại Hasaki là hàng chính hãng có nguồn gốc rõ ràng. Thu gọn",Chưa rõ,https://media.hcdn.vn/catalog/product/p/r/promotions-auto-son-kem-maybelline-min-li-nhu-nhung-cm17-hat-de-6-4ml_qR78YihLn3zEzuVr_img_320x320_b04c1a_fit_center.png,189000,228000,17,5,0,Chưa có,Chưa có,172,AVAILABLE,2025-12-08 04:40:56.974+00,2025-12-08 04:40:56.945+00,2025-12-08 04:40:56.945+00,Other
64b1808c-a807-4838-a89f-a9d8a9135569,Combo 3 Son Dưỡng LipIce Không Màu Chuyển Kem Mịn (Hương Chanh + Hương Dâu + Không Hương) 4.3g,LipIce,Creamy Lipbalm - Lemon + Strawberry + Natural,"Son Dưỡng LipIce Không Màu Chuyển Kem Mịn Creamy Lipbalm là sản phẩm son dưỡng đến từ thương hiệu LipIce ứng dụng công nghệ SON CHUYỂN KEM MỊN độc đáo mang lại cảm giác ẩm mượt tức thì ngay khi vừa thoa lên môi, tựa như bạn vừa thoa một loại kem dưỡng da, cung cấp độ ẩm chuyên sâu cho đôi môi mềm mịn, không còn thô ráp. Đặc biệt, son dưỡng Creamy Lipbalm được bổ sung thêm chỉ số chống nắng SPF15 giúp bảo vệ làn da môi mỏng manh khỏi các tác hại từ ánh nắng mặt trời. Combo 3 Son Dưỡng LipIce Creamy Lipbalm 4.3g hiện đã có mặt tại Hasaki gồm 3 mùi hương: Lemon – Hương Chanh Strawberry – Hương Dâu Natural – Hương Tự Nhiên Ưu thế nổi bật: Sáp Lipocire tạo hệu ứng chuyển ngay sang lớp kem mịn khi son vừa tiếp xúc môi, giúp dưỡng chất thẩm thấu nhanh và lưu giữ độ ẩm lâu hơn. Hỗn hợp Lipid có cấu trúc tương tự cấu trúc lipid trên bề mặt da môi giúp cải thiện và phục hồi nhanh tình trạng nứt nẻ, khô ráp. Phức hợp dưỡng chất Squalane, Phytosteryl Macadamiate, Shea Butter (bơ hạt mỡ) làm mềm môi hiệu quả và dưỡng ẩm tối ưu. Menthyl Nicotinate tạo cảm giác vừa nóng vừa lạnh, dùng hằng ngày giúp dưỡng môi hồng hào, căng mọng. SPF15 chống nắng giúp ngăn ngừa các dấu hiệu lão hóa môi. Bảo quản: Nơi khô ráo thoáng mát. Tránh ánh nắng trực tiếp, nơi có nhiệt độ cao hoặc ẩm ướt. Đậy nắp kín sau khi sử dụng. Thông số sản phẩm: Quy cách đóng gói: 4.3gx3 Thương hiệu: LipIce Xuất xứ thương hiệu: Nhật Bản Nơi sản xuất: Việt Nam Lưu ý: Tác dụng có thể khác nhau tuỳ cơ địa của người dùng Làm sao để phân biệt hàng có trộn hay không? Hàng trộn sẽ không thể xuất hoá đơn GTGT (VAT) 100% được do có hàng không nguồn gốc trong đó. Tại Hasaki, 100% hàng bán ra sẽ được xuất hoá đơn GTGT cho dù khách hàng có lấy hay không. Nếu có nhu cầu lấy hoá đơn GTGT, quý khách vui lòng cung cấp thông tin xuất hóa đơn trong vòng 2 giờ sau khi nhận hàng và trước 22h30 cùng ngày. 2 giờ sau khi giao hàng thành công, hệ thống Hasaki sẽ tự động xuất hết hoá đơn cho những hàng hoá mà khách hàng không đăng kí lấy hoá đơn. Do 100% hàng hóa bán ra đều được xuất hết hóa đơn GTGT trong ngày nên đảm bảo 100% hàng tại Hasaki là hàng chính hãng có nguồn gốc rõ ràng. Thu gọn",Chưa rõ,https://media.hcdn.vn/catalog/product/f/a/facebook-dynamic-combo-3-son-duong-lipice-khong-mau-chuyen-kem-min-huong-chanh-huong-dau-khong-huong-4-3g-1728877235_img_320x320_b04c1a_fit_center.jpg,164000,204000,20,5,0,Chưa có,Chưa có,105,AVAILABLE,2025-12-08 04:40:56.974+00,2025-12-08 04:40:56.945+00,2025-12-08 04:40:56.945+00,Other
bd939fbd-42a6-42d5-8c8b-6380667d280c,Son Kem Lì Glamrr Q 01 Glad Day - Đỏ Nâu 5g,Glamrr Q,Long Wear Lip Cream,"Son Kem Lì Glamrr Q Long Wear Lip Cream 5g là sản phẩm son kem lì đến từ thương hiệu mỹ phẩm Glamrr Q của Hàn Quốc, với bảng màu thời thượng, hợp mọi tông da cùng thành phần nhiều dưỡng, giúp giảm thâm khô và làm sáng hồng môi. Sản phẩm chứa công thức đặc biệt an toàn, lành tính cho làn da nhạy cảm. Hiện sản phẩm Son Kem Lì Glamrr Q Long Wear Lip Cream 5g đã có mặt tại Hasaki với các màu: #01 Glad Day - Đỏ Nâu Hiện Đại: Kết hợp tinh tế giữa sắc đỏ truyền thống với sắc nâu đất (base cam). Màu son không kén tông da. #02 Lovely Day - Đỏ Nâu Trầm Khác Biệt: Hợp với kiểu trang điểm mắt khói khi đánh full môi, nếu chỉ trang điểm nhẹ nhàng thì đánh lòng môi cũng rất xinh. #04 First Day - Đỏ Gạch Trầm Tinh Tế: Màu son thích hợp cho những cô gái theo phong cách dịu dàng, nhẹ nhàng nhưng không kém phần cuốn hút. #05 Gloomy Day - Cam Cháy Thời Thượng: Màu cam cháy chưa bao giờ kén tông da hoặc dáng khuôn mặt. Dùng màu son này khi makeup hoặc để tự nhiên đều rất đẹp. #06 Rainy Day - Đỏ Cam Trẻ Trung: Tông màu phù hợp cả 4 mùa trong năm và không kén màu da, đây luôn là màu son yêu thích của nhiều người. #07 Red Letter Day - Đỏ Thuần Nữ Tính: Sắc đỏ thuần khiết luôn là màu son kinh điển của mọi thời đại. #08 Take A Sip - Đỏ Rượu Vang Lãng Mạn: Nguyên vẹn sự kiêu sa của hoa hồng đỏ, một màu sắc xinh đẹp và vừa vặn trên môi, khiến đối phương say mê nhìn ngắm. #09 Hei Hei - Đỏ Hồng Đào Tươi Tắn: Một chút sắc đỏ pha thêm hồng đào, tiệp với màu phấn má đáng yêu. Màu son này không chỉ tươi tắn tự nhiên, mà còn khiến mỗi ngày thêm đặc biệt! #10 May Beauty - Hồng Đất Nhã Nhặn: Màu son dịu dàng như hoa hồng Centifolia, tạo nên điểm nhấn thanh tú và ngọt ngào cho những quý cô. Lựa chọn quy chuẩn có thể dùng bất cứ lúc nào. #11 Set Sail - Cam Gạch Trầm Quyến Rũ: Điệu đà phá cách, ẩn chứa câu chuyện nàng Rose, đây là màu son sẽ đổ dồn mọi ánh mắt lên đôi môi bạn. Sắc cam ấm ngọt để lại dư âm đậm sâu. #12 Lavish - Cam Đất Cá Tính: Đánh nhạt sẽ cho ra màu cam tự nhiên, hệt màu hoa hồng Juliet. Khi chồng nhiều lớp, màu môi sẽ có sắc đất rõ nét, lôi cuốn cực kỳ. Ưu thế nổi bật: Tinh chất Bisabolol ức chế khả năng hình thành sắc tố melanin trên môi. Shea Butter (Bơ Hạt Mỡ) bảo vệ trước tác hại của tia UV từ ánh nắng mặt trời, hỗ trợ trị thâm môi. Macadamia (Hạt Mắc-ca) duy trì độ ẩm mịn cho môi, ngăn ngừa khô và nứt nẻ môi. Kết cấu: Chất kem bông xốp mềm mịn, khi thoa lên môi lập tức bám chặt vào môi nhẹ như làn da thứ hai. Mùi socola nhẹ khi mới thoa. Lên màu chuẩn chỉ với một lần thoa, giúp giấu khuyết điểm của môi. Khả năng giữ màu tối thiếu 5 tiếng, chỉ trôi nhẹ khi ăn uống, để lại một lớp base đẹp mắt. Bao bì: Thiết kế chủ đạo với màu hồng rosie nữ tính. Vỏ chắc chắn, tránh tình trạng tràn son. Cọ son vát chéo, dễ lấy và dễ tán. Độ an toàn: Đạt kiểm nghiệm da liễu Dermatologist tested. Không chứa thành phần từ động vật, hương liệu, paraben... Công thức đặc biệt an toàn, dịu nhẹ cho cả làn da nhạy cảm. Bảo quản: Nơi khô ráo thoáng mát. Tránh ánh nắng trực tiếp, nơi có nhiệt độ cao hoặc ẩm ướt. Đậy nắp kín sau khi sử dụng. Thông số sản phẩm: Dung tích: 5g Thương hiệu: Glamrr Q Xuất xứ thương hiệu: Hàn Quốc Sản xuất tại: Hàn Quốc Hạn sử dụng: 36 tháng kể từ ngày sản xuất. 12 tháng kể từ khi mở nắp. Lưu ý: Tác dụng có thể khác nhau tuỳ cơ địa của người dùng Làm sao để phân biệt hàng có trộn hay không? Hàng trộn sẽ không thể xuất hoá đơn GTGT (VAT) 100% được do có hàng không nguồn gốc trong đó. Tại Hasaki, 100% hàng bán ra sẽ được xuất hoá đơn GTGT cho dù khách hàng có lấy hay không. Nếu có nhu cầu lấy hoá đơn GTGT, quý khách vui lòng cung cấp thông tin xuất hóa đơn trong vòng 2 giờ sau khi nhận hàng và trước 22h30 cùng ngày. 2 giờ sau khi giao hàng thành công, hệ thống Hasaki sẽ tự động xuất hết hoá đơn cho những hàng hoá mà khách hàng không đăng kí lấy hoá đơn. Do 100% hàng hóa bán ra đều được xuất hết hóa đơn GTGT trong ngày nên đảm bảo 100% hàng tại Hasaki là hàng chính hãng có nguồn gốc rõ ràng. Thu gọn",Chưa rõ,https://media.hcdn.vn/catalog/product/f/a/facebook-dynamic-son-kem-li-glamrr-q-01-glad-day-do-nau-5g-1707123039_img_320x320_b04c1a_fit_center.jpg,168000,250000,33,5,0,Chưa có,Chưa có,142,AVAILABLE,2025-12-08 04:40:56.974+00,2025-12-08 04:40:56.945+00,2025-12-08 04:40:56.945+00,Other
4a173292-8cfc-4783-840f-c07db06f39ae,Son Dưỡng Menard Giàu Ẩm Bạc Hà 3.2g,Menard,Lip Treatment Cool,"Son Dưỡng Môi Menard Lip Treatment Dạng Thỏi 3.2g là sản phẩm son dưỡng của thương hiệu MENARD đến từ Nhật Bản. Son Dưỡng Menard Treatment với dưỡng chất Vitamin E làm mềm mượt đôi môi khô ráp hay nứt nẻ ngay tức thì, đồng thời dưỡng ẩm và bảo vệ làn môi khỏi tác động xấu từ môi trường. Hiện Son Dưỡng Môi Menard Lip Treatment Dạng Thỏi 3.2g đã có mặt tại Hasaki với 2 mùi: Original Bạc hà Đối tượng sử dụng: Người có đôi môi khô, nứt nẻ, dễ bong tróc. Người muốn dưỡng môi nhanh chóng, tiện lợi. Ưu thế nổi bật: Làm mềm môi tức thì. Dưỡng ẩm môi và bảo vệ môi khỏi các tác nhân bên ngoài. Khóa ẩm, làm mềm và giữ cho đôi môi luôn mọng nước. Dễ dàng sử dụng. Không hương liệu, không phụ gia màu tổng hợp. Bảo quản: Nơi khô ráo thoáng mát. Tránh ánh nắng trực tiếp, nơi có nhiệt độ cao hoặc ẩm ướt. Đậy nắp kín sau khi sử dụng. Thông số sản phẩm: Dung tích: 3.2g Thương hiệu: Menard Xuất xứ thương hiệu: Nhật Bản Sản xuất tại: Japan Lưu ý: Tác dụng có thể khác nhau tuỳ cơ địa của người dùng Làm sao để phân biệt hàng có trộn hay không? Hàng trộn sẽ không thể xuất hoá đơn GTGT (VAT) 100% được do có hàng không nguồn gốc trong đó. Tại Hasaki, 100% hàng bán ra sẽ được xuất hoá đơn GTGT cho dù khách hàng có lấy hay không. Nếu có nhu cầu lấy hoá đơn GTGT, quý khách vui lòng cung cấp thông tin xuất hóa đơn trong vòng 2 giờ sau khi nhận hàng và trước 22h30 cùng ngày. 2 giờ sau khi giao hàng thành công, hệ thống Hasaki sẽ tự động xuất hết hoá đơn cho những hàng hoá mà khách hàng không đăng kí lấy hoá đơn. Do 100% hàng hóa bán ra đều được xuất hết hóa đơn GTGT trong ngày nên đảm bảo 100% hàng tại Hasaki là hàng chính hãng có nguồn gốc rõ ràng. Thu gọn",Chưa rõ,https://media.hcdn.vn/catalog/product/f/a/facebook-dynamic-son-duong-moi-menard-vi-bac-ha-dang-thoi-3-2g-1713492924_img_320x320_b04c1a_fit_center.jpg,625000,0,0,5,0,Chưa có,Chưa có,249,AVAILABLE,2025-12-08 04:40:56.974+00,2025-12-08 04:40:56.945+00,2025-12-08 04:40:56.945+00,Other
dbada5a6-817c-48dd-841d-f327e42cd01a,Son Bóng Menard TK Màu Hồng Thanh Tú A300 3.2g,Menard,TK Lipstick,"Son Môi Menard TK Lipstick Giàu Dưỡng là sản phẩm son thỏi của thương hiệu MENARD đến từ Nhật Bản. Son lót dưỡng ẩm Menard TK LipStick có độ dưỡng tốt, độ bền màu lâu, sau khi ăn mà son vẫn không phai màu. Chất son mịn màng, giàu ẩm, tan đều trên môi, nhẹ nhàng và êm ái, cho môi mềm hơn, mọng hơn và xinh hơn. Hiện Son Môi Menard TK Lipstick Giàu Dưỡng 3.2g đã có mặt tại Hasaki với các tone màu bạn lựa chọn: A 130 - Sắc Hồng Mẫu Đơn A 300 - Màu Hồng Thanh Tú A 200 - Màu Cam Đào A 36 - Màu Đỏ Nồng Nàn Ưu thế nổi bật: Dưỡng ẩm vượt trội: Son môi dưỡng ẩm TK LipStick có độ ẩm cao giúp môi bạn luôn mềm mại, mịn màng. Đặc biệt, son dưỡng ngăn ngừa tình trạng khô môi, nứt môi khi thời tiết thay đổi đột ngột. Tinh chất thiên nhiên: Chiết xuất hoa Sơn Chi có thành phần vitamin E tăng cường bảo vệ độ ẩm. Hoa có mùi hương nhẹ nhàng, dễ chịu cho làn môi thêm mọng nước và quyến rũ. Màu sắc đa dạng: Son môi dưỡng ẩm TK LipStick có nhiều màu sắc khác nhau, phù hợp với mọi lứa tuổi và làn da, đem lại cho bạn sự tự tin khi chọn màu môi để tôn vinh vẻ đẹp của mình. Bảo quản: Nơi khô ráo thoáng mát. Tránh ánh nắng trực tiếp, nơi có nhiệt độ cao hoặc ẩm ướt. Đậy nắp kín sau khi sử dụng. Thông số sản phẩm: Dung tích: 3.2g Thương hiệu: Menard Xuất xứ thương hiệu: Nhật Bản Sản xuất tại: Nhật Bản. Lưu ý: Tác dụng có thể khác nhau tuỳ cơ địa của người dùng Làm sao để phân biệt hàng có trộn hay không? Hàng trộn sẽ không thể xuất hoá đơn GTGT (VAT) 100% được do có hàng không nguồn gốc trong đó. Tại Hasaki, 100% hàng bán ra sẽ được xuất hoá đơn GTGT cho dù khách hàng có lấy hay không. Nếu có nhu cầu lấy hoá đơn GTGT, quý khách vui lòng cung cấp thông tin xuất hóa đơn trong vòng 2 giờ sau khi nhận hàng và trước 22h30 cùng ngày. 2 giờ sau khi giao hàng thành công, hệ thống Hasaki sẽ tự động xuất hết hoá đơn cho những hàng hoá mà khách hàng không đăng kí lấy hoá đơn. Do 100% hàng hóa bán ra đều được xuất hết hóa đơn GTGT trong ngày nên đảm bảo 100% hàng tại Hasaki là hàng chính hãng có nguồn gốc rõ ràng. Thu gọn",Chưa rõ,https://media.hcdn.vn/catalog/product/f/a/facebook-dynamic-son-moi-menard-giau-duong-a-300-mau-hong-thanh-tu-3-2g-1713492415_img_320x320_b04c1a_fit_center.jpg,625000,0,0,5,0,Chưa có,Chưa có,153,AVAILABLE,2025-12-08 04:40:56.974+00,2025-12-08 04:40:56.945+00,2025-12-08 04:40:56.945+00,Other
