product_id,name,brand,short_description,description,category,image,price_current,price_original,discount_percent,rating,reviews_count,monthly_sales,sell_progress,inventory_qty,status,status_updated_at,created_at,updated_at,catalog
0f1e5b9a-232a-4a6d-89ad-d4310838e9b9,Son Kem Lì 3CE Sepia - Đỏ Táo Trầm 4.6g,3CE,Blur Water Tint,"Son Kem Lì 3CE Blur Water Tint là dòng son tint dạng nước đến từ thương hiệu 3CE của Hàn Quốc. Lấy cảm hứng từ những đôi môi màu nước mờ, từ lần thoa đầu tiên 3CE Blur Water Tint mang lại cảm giác nhẹ tưng như sương. Chỉ bằng một lần ""chạm nước"" lên môi, chất son nước trong suốt thay đổi thành hai kết cấu từ bóng sang màng mờ. Sau khi thoa, lớp son tạo thành một lớp màng lâu trôi, bền màu, tạo cảm giác nhẹ nhàng và giống như màu môi tự nhiên của bạn. Son Kem Lì 3CE Blur Water Tint 4.6g chính hãng hiện đã có mặt tại Hasaki với bảng màu cực kỳ đa dạng, trendy cho bạn lựa chọn: Play Off: Đỏ Cam San Hô Bake Beige: Cam Hồng Phấn Casual Affair: Hồng Nho Double Wind: Hồng Khô Khói Sepia: Đỏ Táo Trầm Laydown: Thạch Trà Ô Long Chasing Rose: Hồng Kem Sữa Ưu thế nổi bật của Son Kem Lì 3CE Blur Water Tint: CÔNG THỨC GEL MỀM MẠI NHƯ NƯỚC: Kết cấu dạng gel mềm mại, dưỡng ẩm nhẹ nhàng, có khả năng bám màu cực tốt, cho lớp nền môi mịn màng, ẩm mượt mà bạn chưa từng trải nghiệm trước đây. CHO NỀN MÔI MỜ ẢO: Thỏi son được bổ sung thêm một lớp kem lót nhẹ, mang đến cho bạn làn môi mềm mịn với độ che phủ đáng ngạc nhiên. CẢM GIÁC THOẢI MÁI & NHẸ NHÀNG: Thỏi son có công thức chống thấm giúp đôi môi mịn nhẹ và thoải mái cả ngày dài, không gây bết dính dù bạn đeo khẩu trang. Hướng dẫn bảo quản Son Kem Lì 3CE Blur Water Tint: Để xa tầm tay trẻ em. Tránh ánh nắng trực tiếp. Đậy nắp kín sau khi sử dụng. Lưu ý: Ngày sản xuất: Xem trên bao bì. Hạn sử dụng: 36 tháng kể từ ngày sản xuất. Làm sao để phân biệt hàng có trộn hay không? Hàng trộn sẽ không thể xuất hoá đơn GTGT (VAT) 100% được do có hàng không nguồn gốc trong đó. Tại Hasaki, 100% hàng bán ra sẽ được xuất hoá đơn GTGT cho dù khách hàng có lấy hay không. Nếu có nhu cầu lấy hoá đơn GTGT, quý khách vui lòng cung cấp thông tin xuất hóa đơn trong vòng 2 giờ sau khi nhận hàng và trước 22h30 cùng ngày. 2 giờ sau khi giao hàng thành công, hệ thống Hasaki sẽ tự động xuất hết hoá đơn cho những hàng hoá mà khách hàng không đăng kí lấy hoá đơn. Do 100% hàng hóa bán ra đều được xuất hết hóa đơn GTGT trong ngày nên đảm bảo 100% hàng tại Hasaki là hàng chính hãng có nguồn gốc rõ ràng. Thu gọn",Chưa rõ,https://media.hcdn.vn/catalog/product/f/a/facebook-dynamic-son-kem-3ce-blur-water-tint-sepia-mau-do-gach-4-6g-1750214798_img_320x320_b04c1a_fit_center.jpg,249000,378000,34,5,0,Chưa có,Chưa có,113,AVAILABLE,2025-12-08 04:40:56.947+00,2025-12-08 04:40:56.945+00,2025-12-08 04:40:56.945+00,Other
4cc15b70-4c0e-4e41-9abf-e83cd0fbd96a,Son Dưỡng Môi DHC Không Màu Hỗ Trợ Giảm Thâm Môi 1.5g,DHC,Lip Cream,"Son Dưỡng Môi DHC Không Màu Hỗ Trợ Giảm Thâm Môi 1.5g là sản phẩm son dưỡng môi đến từ thương hiệu DHC của Nhật Bản. Công thức son chứa chiết xuất từ Olive đậm đặc sẽ giúp dưỡng ẩm và khoá ẩm cho đôi môi lên đến 8 giờ, cải thiện hiệu quả tình trạng da môi khô nứt nẻ, đồng thời giảm thâm và làm hồng môi. Đặc biệt, son hoàn toàn không gây cảm giác bóng nhờn, bết dính hay nặng môi. Sản phẩm chỉ để lại một lớp màng mỏng nhẹ, giúp tạo hiệu ứng môi căng mọng, đầy đặn và có sức sống hơn. Son Dưỡng Môi DHC Lip Cream 1.5g chính hãng hiện đã có mặt tại Hasaki. Đối tượng sử dụng Son Dưỡng Môi DHC Lip Cream: Những ai có đôi môi thường xuyên bị tình trạng khô ráp, nứt nẻ, bong tróc,... Những ai thường xuyên trang điểm, cần sản phẩm giúp dưỡng mềm môi, hỗ trợ cho son môi lên màu đẹp hơn. Sản phẩm có thể sử dụng cho cả nam và nữ. Ưu thế nổi bật của Son Dưỡng Môi DHC Lip Cream: Thành phần giàu chất cấp ẩm từ dầu olive nguyên chất cùng vitamin E và lô hội: Dưỡng môi mềm mịn, bảo vệ môi trước nhiều tác động và giữ cho đôi môi căng mọng suốt ngày dài. Ngăn ngừa các dấu hiệu lão hóa, hỗ trợ giảm thâm môi hiệu quả, làm hồng môi và khắc phục tình trạng nứt rãnh môi. Có thể dùng son DHC làm lớp nền hoàn hảo trước khi thoa son màu. Độ an toàn: Không hương liệu. Không chất tạo màu. Không paraben. Hướng dẫn bảo quản Son Dưỡng Môi DHC Lip Cream: Bảo quản sản phẩm ở nơi khô ráo, thoáng mát, tránh tiếp xúc trực tiếp với ánh nắng mặt trời. Đậy kín nắp sau mỗi lần sử dụng để ngăn ngừa sản phẩm bị oxy hóa hoặc nhiễm khuẩn. Không để sản phẩm ở nơi có nhiệt độ quá cao (trên 30°C) hoặc độ ẩm quá lớn để duy trì chất lượng. Để xa tầm tay trẻ em. Lưu ý: Tác dụng có thể khác nhau tuỳ cơ địa của người dùng Làm sao để phân biệt hàng có trộn hay không? Hàng trộn sẽ không thể xuất hoá đơn GTGT (VAT) 100% được do có hàng không nguồn gốc trong đó. Tại Hasaki, 100% hàng bán ra sẽ được xuất hoá đơn GTGT cho dù khách hàng có lấy hay không. Nếu có nhu cầu lấy hoá đơn GTGT, quý khách vui lòng cung cấp thông tin xuất hóa đơn trong vòng 2 giờ sau khi nhận hàng và trước 22h30 cùng ngày. 2 giờ sau khi giao hàng thành công, hệ thống Hasaki sẽ tự động xuất hết hoá đơn cho những hàng hoá mà khách hàng không đăng kí lấy hoá đơn. Do 100% hàng hóa bán ra đều được xuất hết hóa đơn GTGT trong ngày nên đảm bảo 100% hàng tại Hasaki là hàng chính hãng có nguồn gốc rõ ràng. Thu gọn",Chưa rõ,https://media.hcdn.vn/catalog/product/f/a/facebook-dynamic-son-duong-moi-khong-mau-dhc-ho-tro-giam-tham-moi-1-5g-1726645943_img_320x320_b04c1a_fit_center.jpg,140000,199000,30,5,0,Chưa có,Chưa có,220,AVAILABLE,2025-12-08 04:40:56.948+00,2025-12-08 04:40:56.945+00,2025-12-08 04:40:56.945+00,Other
0782181c-c2ec-4159-9636-35fc524140ad,Son Tint Lì Mastige Blur Lâu Trôi Màu B5 Đỏ Gạch 3.8g,Mastige,Blur Lip Tint - B5 Classic,"Son Kem Mastige Blur Lip Tint Mịn Mờ 3.8g là sản phẩm son kem đến từ thương hiệu mỹ phẩm Mastige Việt Nam. Mastige Blur Lip Tint mang đến trải nghiệm Tan mượt 3s – Mịn nhẹ 8h. Chất son tint lỏng dễ tán, Chạm môi là tan – Lì mờ như nhung – Nhẹ như không khí, mịn lì lâu trôi với lớp blur tự nhiên tan và khoá chặt trên môi. Hiện sản phẩm Son Kem Mastige Blur Lip Tint Mịn Mờ 3.8g đã có mặt tại Hasaki với 6 tông màu: B1 Individual - Hồng Dâu B2 Lady Like - Hồng Cam Sữa B3 Preppy - Cam Cháy B4 Retro - Hồng Trà B5 Classic - Đỏ Gạch B6 Chic - Đỏ Hồng Ưu thế nổi bật: Công nghệ hiện đại, tích hợp 3 công nghệ: Công nghệ infused water với 43% hàm lượng nước giúp môi cảm giác mát tức thì, vực dậy đôi môi đang khô của bạn, nhờ đó môi khi mới thoa có cảm giác căng tràn sức sống. Hiệu ứng chuyển đổi chất giúp chất tint dễ tán sang hiệu ứng blur trên môi, tạo cảm giác môi mịn, nhẹ, trông tự nhiên hơn. Công nghệ khoá màu giúp cho lớp Blur tuy mỏng nhẹ nhưng lại bền màu lâu trôi, ở trên môi và khoá luôn cả độ ẩm mịn cho môi lúc nào cũng Mỏng Nhẹ - Mềm Mịn - Đều Màu. Che phủ hoàn hảo: Làm mờ rãnh môi, tạo lớp finish đều màu và mềm mịn. Vegan thuần chay: Thành phần an toàn, thân thiện với môi trường. Bảng màu đa dạng: 6 sắc thái dẫn đầu xu hướng, phù hợp mọi phong cách. Đầu cọ thông minh, chất liệu lông và đầu vát được thiết kế tỉ mỉ và đa năng, giúp dễ lấy lượng son vừa đủ, tán mượt các dùng to nhỏ và linh hoạt di chuyển trên môi khi thoa. Bao bì chắc chắn, sang trọng. Hiệu quả sử dụng: Lúc mới thoa, chất son tint lỏng nhe, tan chảy và phủ đầy rãnh môi. Lớp finish lì, mịn tự nhiên như nhung, nhẹ nhàng và thoải mái. Màu sắc bền lâu, không trôi suốt 8h. Đôi môi được dưỡng mềm mại, không khô ráp hay bong tróc. Bảo quản: Bảo quản nơi khô ráo và tránh ánh nắng mặt trời. Tránh xa tầm với của trẻ em. Thông số sản phẩm: Dung tích: 3.8g Thương hiệu: Mastige Xuất xứ thương hiệu: Việt Nam Sản xuất tại: Hàn Quốc. Lưu ý: Tác dụng có thể khác nhau tuỳ cơ địa của người dùng Làm sao để phân biệt hàng có trộn hay không? Hàng trộn sẽ không thể xuất hoá đơn GTGT (VAT) 100% được do có hàng không nguồn gốc trong đó. Tại Hasaki, 100% hàng bán ra sẽ được xuất hoá đơn GTGT cho dù khách hàng có lấy hay không. Nếu có nhu cầu lấy hoá đơn GTGT, quý khách vui lòng cung cấp thông tin xuất hóa đơn trong vòng 2 giờ sau khi nhận hàng và trước 22h30 cùng ngày. 2 giờ sau khi giao hàng thành công, hệ thống Hasaki sẽ tự động xuất hết hoá đơn cho những hàng hoá mà khách hàng không đăng kí lấy hoá đơn. Do 100% hàng hóa bán ra đều được xuất hết hóa đơn GTGT trong ngày nên đảm bảo 100% hàng tại Hasaki là hàng chính hãng có nguồn gốc rõ ràng. Thu gọn",Chưa rõ,https://media.hcdn.vn/catalog/product/p/r/promotions-auto-son-kem-mastige-min-mo-b5-classic-do-gach-3-8g_JfD4cJ1YpaFis35y_img_320x320_b04c1a_fit_center.png,189000,359000,47,5,0,Chưa có,Chưa có,257,AVAILABLE,2025-12-08 04:40:56.948+00,2025-12-08 04:40:56.945+00,2025-12-08 04:40:56.945+00,Other
42da09d7-943d-4e78-9df7-dee973f00dd6,[Mini] Son Kem Lì 3CE Laydown - Hồng Đào Trầm Pha Nâu 1.5g,3CE,Blur Water Tint,"Son Kem Lì 3CE Laydown - Hồng Đào Trầm Pha Nâu là dòng son tint dạng nước đến từ thương hiệu 3CE của Hàn Quốc. Với chất son trơn mịn, mọng nước ngay từ lần thoa đầu tiên, Blur Water Tint sẽ mang đến cho bạn một làn môi mềm mại, căng mọng, đầy vẻ hờn dỗi nũng nịu. Son Kem Lì 3CE Blur Water Tint Laydown 1.5g hiện đã có mặt tại Hasaki. Ưu thế nổi bật: CÔNG THỨC GEL MỀM MẠI NHƯ NƯỚC: Kết cấu dạng gel mềm mại, dưỡng ẩm nhẹ nhàng, có khả năng bám màu cực tốt, cho lớp nền môi mịn màng, ẩm mượt mà bạn chưa từng trải nghiệm trước đây. CHO NỀN MÔI MỜ ẢO: Thỏi son được bổ sung thêm một lớp kem lót nhẹ, mang đến cho bạn làn môi mềm mịn với độ che phủ đáng ngạc nhiên. CẢM GIÁC THOẢI MÁI & NHẸ NHÀNG: Thỏi son có công thức chống thấm giúp đôi môi mịn nhẹ và thoải mái cả ngày dài, không gây bết dính dù bạn đeo khẩu trang. Bảo quản: Để xa tầm tay trẻ em. Tránh ánh nắng trực tiếp. Đậy nắp kín sau khi sử dụng. Thông số sản phẩm: Thương hiệu: 3CE Xuất xứ thương hiệu: Hàn Quốc Sản xuất tại: Hàn Quốc Khối lượng tịnh: 1.5g Hạn sử dụng: 24 - 36 tháng, 12 tháng sau khi mở. Lưu ý: Tác dụng có thể khác nhau tuỳ cơ địa của người dùng Làm sao để phân biệt hàng có trộn hay không? Hàng trộn sẽ không thể xuất hoá đơn GTGT (VAT) 100% được do có hàng không nguồn gốc trong đó. Tại Hasaki, 100% hàng bán ra sẽ được xuất hoá đơn GTGT cho dù khách hàng có lấy hay không. Nếu có nhu cầu lấy hoá đơn GTGT, quý khách vui lòng cung cấp thông tin xuất hóa đơn trong vòng 2 giờ sau khi nhận hàng và trước 22h30 cùng ngày. 2 giờ sau khi giao hàng thành công, hệ thống Hasaki sẽ tự động xuất hết hoá đơn cho những hàng hoá mà khách hàng không đăng kí lấy hoá đơn. Do 100% hàng hóa bán ra đều được xuất hết hóa đơn GTGT trong ngày nên đảm bảo 100% hàng tại Hasaki là hàng chính hãng có nguồn gốc rõ ràng. Thu gọn",Chưa rõ,https://media.hcdn.vn/catalog/product/f/a/facebook-dynamic-mini-son-kem-li-3ce-laydown-hong-dao-tram-pha-nau-1-5g-1736561075_img_320x320_b04c1a_fit_center.jpg,69000,100000,31,5,0,Chưa có,Chưa có,175,AVAILABLE,2025-12-08 04:40:56.948+00,2025-12-08 04:40:56.945+00,2025-12-08 04:40:56.945+00,Other
388c3598-c2c0-435a-9ef4-41329cec0a04,[Mini] Son Kem Lì 3CE Casual Affair - Hoa Hồng Khô 1.5g,3CE,Blur Water Tint,"Son Kem Lì 3CE Casual Affair - Hoa Hồng Khô là dòng son tint dạng nước đến từ thương hiệu 3CE của Hàn Quốc. Với chất son trơn mịn, mọng nước ngay từ lần thoa đầu tiên, Blur Water Tint sẽ mang đến cho bạn một làn môi mềm mại, căng mọng, đầy vẻ hờn dỗi nũng nịu. Son Kem Lì 3CE Blur Water Tint Casual Affair 1.5g hiện đã có mặt tại Hasaki. Ưu thế nổi bật: CÔNG THỨC GEL MỀM MẠI NHƯ NƯỚC: Kết cấu dạng gel mềm mại, dưỡng ẩm nhẹ nhàng, có khả năng bám màu cực tốt, cho lớp nền môi mịn màng, ẩm mượt mà bạn chưa từng trải nghiệm trước đây. CHO NỀN MÔI MỜ ẢO: Thỏi son được bổ sung thêm một lớp kem lót nhẹ, mang đến cho bạn làn môi mềm mịn với độ che phủ đáng ngạc nhiên. CẢM GIÁC THOẢI MÁI & NHẸ NHÀNG: Thỏi son có công thức chống thấm giúp đôi môi mịn nhẹ và thoải mái cả ngày dài, không gây bết dính dù bạn đeo khẩu trang. Bảo quản: Để xa tầm tay trẻ em. Tránh ánh nắng trực tiếp. Đậy nắp kín sau khi sử dụng. Thông số sản phẩm: Thương hiệu: 3CE Xuất xứ thương hiệu: Hàn Quốc Sản xuất tại: Hàn Quốc Khối lượng tịnh: 1.5g Hạn sử dụng: 24 - 36 tháng, 12 tháng sau khi mở. Lưu ý: Tác dụng có thể khác nhau tuỳ cơ địa của người dùng Làm sao để phân biệt hàng có trộn hay không? Hàng trộn sẽ không thể xuất hoá đơn GTGT (VAT) 100% được do có hàng không nguồn gốc trong đó. Tại Hasaki, 100% hàng bán ra sẽ được xuất hoá đơn GTGT cho dù khách hàng có lấy hay không. Nếu có nhu cầu lấy hoá đơn GTGT, quý khách vui lòng cung cấp thông tin xuất hóa đơn trong vòng 2 giờ sau khi nhận hàng và trước 22h30 cùng ngày. 2 giờ sau khi giao hàng thành công, hệ thống Hasaki sẽ tự động xuất hết hoá đơn cho những hàng hoá mà khách hàng không đăng kí lấy hoá đơn. Do 100% hàng hóa bán ra đều được xuất hết hóa đơn GTGT trong ngày nên đảm bảo 100% hàng tại Hasaki là hàng chính hãng có nguồn gốc rõ ràng. Thu gọn",Chưa rõ,https://media.hcdn.vn/catalog/product/f/a/facebook-dynamic-mini-son-kem-li-3ce-casual-affair-hoa-hong-kho-1-5g-1736561878_img_320x320_b04c1a_fit_center.jpg,69000,100000,31,5,0,Chưa có,Chưa có,267,AVAILABLE,2025-12-08 04:40:56.948+00,2025-12-08 04:40:56.945+00,2025-12-08 04:40:56.945+00,Other
1145b13c-7bd8-4855-b233-f4c435fc6966,Son Kem Lì 3CE Mịn Màng Như Nhung Childlike - Cam Cháy 4g,3CE,Velvet Lip Tint,"Son Kem Lì 3CE Velvet Lip Tint 4g là sản phẩm son kem đến từ thương hiệu mỹ phẩm 3CE của Hàn Quốc, có chất kem mềm mịn tựa như mousse, và là sự kết hợp độc đáo giữa son kem lì và son tint nên chất son vô cùng mỏng nhẹ, không hề gây cảm giác nặng môi như những dòng son kem lì khác, cùng mùi hương Vani ngọt ngào. Son Kem Lì Mịn Màng Như Nhung 3CE Velvet Lip Tint chính hãng hiện đã có mặt tại Hasaki với bảng màu vô cùng đa dạng cho bạn có thể thỏa sức lựa chọn: Child Like - Cam Cháy Taupe - Đỏ Gạch Speak Up - Lê Đỏ Ngâm Walk N Talk - Cam Trà Sữa Daffodil - Đậu Đỏ Going Right - Hồng Cá Hồi Private - Đỏ Lạnh Best Ever - Đỏ Cánh Hồng Khô Ưu thế nổi bật của Son Kem Lì 3CE Velvet Lip Tint: Son có cấu trúc velvet mỏng nhẹ, phủ đều lên đôi môi. Công thức giàu dưỡng lấp đầy rãnh môi giúp che đi khuyết điểm và son lên màu căng mướt. Công thức son mềm mịn như nhung, không gây nặng môi, bền màu và lâu trôi. Thiết kế siêu xinh, màu sắc đa dạng từ tone đỏ tươi nổi bật cho đến tone nude trầm ấm, hay hồng san hô dịu dàng, nhẹ nhàng thích hợp cho các cô nàng nữ tính, trang điểm thường ngày. Hướng dẫn bảo quản Son Kem Lì 3CE Velvet Lip Tint: Tránh ánh nắng trực tiếp. Để nơi khô ráo, thoáng mát. Đậy nắp kín sau khi sử dụng. Lưu ý: Ngày sản xuất: Xem trên bao bì. Hạn sử dụng: 30 tháng kể từ ngày sản xuất. Lưu ý: Tác dụng có thể khác nhau tuỳ cơ địa của người dùng Làm sao để phân biệt hàng có trộn hay không? Hàng trộn sẽ không thể xuất hoá đơn GTGT (VAT) 100% được do có hàng không nguồn gốc trong đó. Tại Hasaki, 100% hàng bán ra sẽ được xuất hoá đơn GTGT cho dù khách hàng có lấy hay không. Nếu có nhu cầu lấy hoá đơn GTGT, quý khách vui lòng cung cấp thông tin xuất hóa đơn trong vòng 2 giờ sau khi nhận hàng và trước 22h30 cùng ngày. 2 giờ sau khi giao hàng thành công, hệ thống Hasaki sẽ tự động xuất hết hoá đơn cho những hàng hoá mà khách hàng không đăng kí lấy hoá đơn. Do 100% hàng hóa bán ra đều được xuất hết hóa đơn GTGT trong ngày nên đảm bảo 100% hàng tại Hasaki là hàng chính hãng có nguồn gốc rõ ràng. Thu gọn",Chưa rõ,https://media.hcdn.vn/catalog/product/f/a/facebook-dynamic-son-kem-li-3ce-mau-do-cam-child-like-4g-1750216585_img_320x320_b04c1a_fit_center.jpg,249000,378000,34,5,0,Chưa có,Chưa có,208,AVAILABLE,2025-12-08 04:40:56.949+00,2025-12-08 04:40:56.945+00,2025-12-08 04:40:56.945+00,Other
871f690b-de88-4672-8653-bfb7b62d3020,Sáp Tẩy Trang Banila Co Original Cho Mọi Loại Da 100ml,Banila Co,Clean it Zero Cleansing Balm #Original,"Sáp Tẩy Trang Banila Co Original Cho Mọi Loại Da Clean it Zero Cleansing Balm là sản phẩm sáp tẩy trang ""quốc dân"" bán chạy hàng đầu của thương hiệu mỹ phẩm Banila Co đến từ Hàn Quốc, với khả năng làm sạch sâu nhanh chóng và hiệu quả, từ sản phẩm chống nắng đến makeup chống thấm nước, đồng thời cung cấp độ ẩm cho da mềm mịn, không bị khô căng sau khi tẩy trang. Bên cạnh đó, chiết xuất Acerola và Vitamin C giúp chống oxy hoá và hỗ trợ dưỡng sáng da. Hiện sản phẩm Sáp Tẩy Trang Banila Co Clean it Zero Cleansing Balm #Original đã có mặt tại Hasaki được thiết kế dành cho mọi loại da. Sáp Tẩy Trang Banila Co Original Cho Mọi Loại Da phù hợp với loại da nào? Sản phẩm thích hợp tẩy trang cho mọi loại da. Ưu thế nổi bật của Sáp Tẩy Trang Banila Co Original Cho Mọi Loại Da: Bằng cách lên men nước khoáng từ các suối nước nóng ở Pháp, phân tử thành phần hoạt chất có lợi trở nên nhỏ hơn được hấp thụ sâu vào da sau quá trình rửa mặt, mang lại hiệu quả tuyệt vời về dưỡng ẩm và làm dịu da. Thành phần chống oxi hóa chính của Clean It Zero kết hợp từ chiết xuất Acerola và Vitamin C. Chiết xuất cranberrys - dưỡng da khỏe mạnh. Chiết xuất lựu - Mang lại sự sức sống cho làn da. Sản phẩm là dạng sáp không có mùi (no perfume). Có khả năng làm sạch sâu từ sản phẩm chống nắng đến lớp trang điểm chống thấm nước, tất cả chỉ trong một bước duy nhất! Sản phẩm thân thiện với làn da, có thể sử dụng cho mắt và môi. Công dụng: Giúp tẩy sạch kem chống nắng và lớp trang điểm mặt / mắt môi, kể cả sản phẩm chống thấm nước. Cung cấp độ ẩm, giúp da mềm mại, không bị khô rát sau khi tẩy trang. Chống oxy hoá và hỗ trợ dưỡng sáng da. Độ an toàn: Đã qua kiểm định không gây kích ứng da. Đã hoàn thành bài kiểm tra kích ứng mắt. Không chứa 23 thành phần gây hại. Không có chất tạo màu nhân tạo: Sáp tẩy trang Banila Co có màu hồng tươi được tạo từ thành phần chiết xuất thực vật. Công thức thuần chay, không chứa thành phần từ động vật. Hướng dẫn bảo quản Sáp Tẩy Trang Banila Co Original Cho Mọi Loại Da: Nơi khô ráo thoáng mát. Tránh ánh nắng trực tiếp, nơi có nhiệt độ cao hoặc ẩm ướt. Đậy nắp kín sau khi sử dụng. Làm sao để phân biệt hàng có trộn hay không? Hàng trộn sẽ không thể xuất hoá đơn GTGT (VAT) 100% được do có hàng không nguồn gốc trong đó. Tại Hasaki, 100% hàng bán ra sẽ được xuất hoá đơn GTGT cho dù khách hàng có lấy hay không. Nếu có nhu cầu lấy hoá đơn GTGT, quý khách vui lòng cung cấp thông tin xuất hóa đơn trong vòng 2 giờ sau khi nhận hàng và trước 22h30 cùng ngày. 2 giờ sau khi giao hàng thành công, hệ thống Hasaki sẽ tự động xuất hết hoá đơn cho những hàng hoá mà khách hàng không đăng kí lấy hoá đơn. Do 100% hàng hóa bán ra đều được xuất hết hóa đơn GTGT trong ngày nên đảm bảo 100% hàng tại Hasaki là hàng chính hãng có nguồn gốc rõ ràng. Thu gọn",Chưa rõ,https://media.hcdn.vn/catalog/product/f/a/facebook-dynamic-sap-tay-trang-banila-co-original-cho-moi-loai-da-100ml-1740631254_img_320x320_b04c1a_fit_center.jpg,267000,480000,44,5,0,Chưa có,Chưa có,127,AVAILABLE,2025-12-08 04:40:56.949+00,2025-12-08 04:40:56.945+00,2025-12-08 04:40:56.945+00,Other
