Tên sản phẩm,Thương hiệu,Giá hiện tại,Giá gốc,Giảm giá,Ảnh,Link sản phẩm,Mô tả ngắn,Đánh giá sao,Số lượt đánh giá,Mua/tháng,Tiến độ bán,Ưu đãi/Quà tặng,Nguồn,Giá hiện tại_extra,Mô tả,Thông số,HDSD,Thành phần,Đánh giá
Tên sản phẩm,Thương hiệu,Giá hiện tại,Giá gốc,Giảm giá,Ảnh,Link sản phẩm,Mô tả ngắn,Rating,Số lượt đánh giá,Mua/tháng,Tiến độ bán,Ưu đãi/Quà tặng,Nguồn,Giá hiện tại_extra,Mô tả,Thông số,HDSD,Thành phần,Đánh giá
Son Kem Lì 3CE Sepia - Đỏ Táo Trầm 4.6g,3CE,249.000 ₫,378.000 ₫,-34 %,https://media.hcdn.vn/catalog/product/f/a/facebook-dynamic-son-kem-3ce-blur-water-tint-sepia-mau-do-gach-4-6g-1750214798_img_320x320_b04c1a_fit_center.jpg,https://hasaki.vn/san-pham/son-kem-3ce-blur-water-tint-sepia-mau-do-gach-4-6g-99019.html,Blur Water Tint,4.7,,162/tháng,55%,,https://hasaki.vn/danh-muc/trang-diem-moi-c24.html,249.000 ₫,"Son Kem Lì 3CE Blur Water Tint là dòng son tint dạng nước đến từ thương hiệu 3CE của Hàn Quốc. Lấy cảm hứng từ những đôi môi màu nước mờ, từ lần thoa đầu tiên 3CE Blur Water Tint mang lại cảm giác nhẹ tưng như sương. Chỉ bằng một lần ""chạm nước"" lên môi, chất son nước trong suốt thay đổi thành hai kết cấu từ bóng sang màng mờ. Sau khi thoa, lớp son tạo thành một lớp màng lâu trôi, bền màu, tạo cảm giác nhẹ nhàng và giống như màu môi tự nhiên của bạn. Son Kem Lì 3CE Blur Water Tint 4.6g chính hãng hiện đã có mặt tại Hasaki với bảng màu cực kỳ đa dạng, trendy cho bạn lựa chọn: Play Off: Đỏ Cam San Hô Bake Beige: Cam Hồng Phấn Casual Affair: Hồng Nho Double Wind: Hồng Khô Khói Sepia: Đỏ Táo Trầm Laydown: Thạch Trà Ô Long Chasing Rose: Hồng Kem Sữa Ưu thế nổi bật của Son Kem Lì 3CE Blur Water Tint: CÔNG THỨC GEL MỀM MẠI NHƯ NƯỚC: Kết cấu dạng gel mềm mại, dưỡng ẩm nhẹ nhàng, có khả năng bám màu cực tốt, cho lớp nền môi mịn màng, ẩm mượt mà bạn chưa từng trải nghiệm trước đây. CHO NỀN MÔI MỜ ẢO: Thỏi son được bổ sung thêm một lớp kem lót nhẹ, mang đến cho bạn làn môi mềm mịn với độ che phủ đáng ngạc nhiên. CẢM GIÁC THOẢI MÁI & NHẸ NHÀNG: Thỏi son có công thức chống thấm giúp đôi môi mịn nhẹ và thoải mái cả ngày dài, không gây bết dính dù bạn đeo khẩu trang. Hướng dẫn bảo quản Son Kem Lì 3CE Blur Water Tint: Để xa tầm tay trẻ em. Tránh ánh nắng trực tiếp. Đậy nắp kín sau khi sử dụng. Lưu ý: Ngày sản xuất: Xem trên bao bì. Hạn sử dụng: 36 tháng kể từ ngày sản xuất. Làm sao để phân biệt hàng có trộn hay không? Hàng trộn sẽ không thể xuất hoá đơn GTGT (VAT) 100% được do có hàng không nguồn gốc trong đó. Tại Hasaki, 100% hàng bán ra sẽ được xuất hoá đơn GTGT cho dù khách hàng có lấy hay không. Nếu có nhu cầu lấy hoá đơn GTGT, quý khách vui lòng cung cấp thông tin xuất hóa đơn trong vòng 2 giờ sau khi nhận hàng và trước 22h30 cùng ngày. 2 giờ sau khi giao hàng thành công, hệ thống Hasaki sẽ tự động xuất hết hoá đơn cho những hàng hoá mà khách hàng không đăng kí lấy hoá đơn. Do 100% hàng hóa bán ra đều được xuất hết hóa đơn GTGT trong ngày nên đảm bảo 100% hàng tại Hasaki là hàng chính hãng có nguồn gốc rõ ràng. Thu gọn","{Barcode: 8809664983511, Thương Hiệu: 3CE, Xuất xứ thương hiệu: Hàn Quốc, Nơi sản xuất: China, Đặc tính: Dạng lì, Dung Tích: 4.6g}","Hướng dẫn sử dụng Cách sử dụng: Lấy một lượng nhỏ son môi và thoa nhẹ nhàng lên môi. Lưu ý khi sử dụng: Nếu bạn gặp các triệu chứng sau trong hoặc sau khi sử dụng, vui lòng tạm ngừng sử dụng và hỏi ý kiến bác sĩ: đốm đỏ, sưng tấy, ngứa ngáy hoặc bất kỳ tác dụng phụ nào khác. Không sử dụng sản phẩm trên vết thương hoặc bất kỳ vùng da nào bị kích ứng.","Thành phần sản phẩm 1. Son Kem Lì 3CE Laydown - Hồng Đào Trầm Pha Nâu 4.6g Water, Dimethicone, Dimethicone/Vinyl Dimethicone Crosspolymer, Glycerin, Alcohol Denat., Pentylene Glycol, Polyglyceryl10 Myristate, Polyacrylate Crosspolymer-6, Butylene Glycol, Dimethicone Crosspolymer, Ceteareth-20, Ethylhexylglycerin, Trisodium Ethylenediamine Disuccinate, Arginine, Aluminum Hydroxide, Ammonium Polyacrylate, Carbomer, Phenoxyethanol, Fragrance(Parfum), Titanium Dioxide (CI 77891), Acid Red 18 (CI 16255), Yellow 6 (CI 15985), Red 33 (CI 17200), Yellow 5 (CI 19140), Blue 1 (CI 42090). 2. Son Kem Lì 3CE Sepia - Đỏ Gạch Đậm 4.6g Water, Dimethicone, Dimethicone/Vinyl Dimethicone Crosspolymer, Glycerin, Alcohol Denat., Pentylene Glycol, Polyglyceryl10 Myristate, Polyacrylate Crosspolymer-6, Butylene Glycol, Dimethicone Crosspolymer, Ceteareth-20, Ethylhexylglycerin, Trisodium Ethylenediamine Disuccinate, Arginine, Aluminum Hydroxide, Ammonium Polyacrylate, Carbomer, Phenoxyethanol, Fragrance(Parfum), Yellow 6 (CI 15985), Titanium Dioxide (CI 77891), Red 33 (CI 17200), Blue 1 (CI 42090). 3. Son Kem Lì 3CE Play Off - Đỏ Cổ Điển 4.6g Water, Dimethicone, Dimethicone/Vinyl Dimethicone Crosspolymer, Glycerin, Alcohol Denat., Pentylene Glycol, Polyglyceryl10 Myristate, Polyacrylate Crosspolymer-6, Butylene Glycol, Dimethicone Crosspolymer, Ceteareth-20, Ethylhexylglycerin, Trisodium Ethylenediamine Disuccinate, Arginine, Carbomer, Phenoxyethanol, Fragrance(Parfum), Acid Red 18 (CI 16255), Red 33 (CI 17200), Yellow 6 (CI 15985), Yellow 5 (CI 19140), Blue 1 (CI 42090). 4. Son Kem Lì 3CE Casual Affair - Hoa Hồng Khô 4.6g Water, Dimethicone, Dimethicone/Vinyl Dimethicone Crosspolymer, Glycerin, Alcohol Denat., Pentylene Glycol, Polyglyceryl10 Myristate, Polyacrylate Crosspolymer-6, Butylene Glycol, Dimethicone Crosspolymer, Ceteareth-20, Ethylhexylglycerin, Trisodium Ethylenediamine Disuccinate, Aluminum Hydroxide, Ammonium Polyacrylate, Arginine, Carbomer, Phenoxyethanol, Fragrance(Parfum), Titanium Dioxide (CI 77891), Yellow 6 (CI 15985), Red 33 (CI 17200), Yellow 5 (CI 19140), Red 28 (CI 45410), Blue 1 (CI 42090). 5. Son Kem Lì 3CE Bake Beige - Nâu Cam Cháy Cổ Điển 4.6g Water, Dimethicone, Dimethicone/Vinyl Dimethicone Crosspolymer, Glycerin, Alcohol Denat, Pentylene Glycol, Polyglyceryl-10 Myristate, Polyacrylate Crosspolymer-6, Butylene Glycol, Dimethicone Crosspolymer, Phenoxyethanol, Ceteareth-20, Titanium Dioxide (CI 77891), Ethylhexylglycerin, Fragrance(Parfum), Yellow 6 (CI 15985), Red 33 (CI 17200), Yellow 5 (CI 19140), Trisodium Ethylenediamine Disuccinate, Acid Red 18 (CI 16255), Arginine, Carbomer, Aluminum Hydroxide, Ammonium Polyacrylate, Blue 1 (CI 42090). 6. Son Kem Lì 3CE Chasing Rose - Hoa Hồng Be 4.6g Water, Dimethicone, Dimethicone/Vinyl Dimethicone Crosspolymer, Glycerin, Alcohol Denat., Pentylene Glycol, Polyglyceryl-10 Myristate, Polyacrylate Crosspolymer-6, Dimethicone Crosspolymer, Butylene Glycol, Phenoxyethanol, Ceteareth-20, Titanium Dioxide (CI 77891), Ethylhexylglycerin, Fragrance(Parfum), Yellow 6 (CI 15985), Red 33 (CI 17200), Trisodium Ethylenediamine Disuccinate, t-Butyl Alcohol, Aluminum Hydroxide, Yellow 5 (CI 19140), Ammonium Polyacrylate, Arginine, Carbomer, Blue 1 (CI 42090) 7. Son Kem Lì 3CE Double Wind - Đỏ Rượu Vang 4.6g Water, Dimethicone, Dimethicone/Vinyl Dimethicone Crosspolymer, Glycerin, Alcohol Denat., Pentylene Glycol, Polyglyceryl-10 Myristate, Polyacrylate Crosspolymer-6, Butylene Glycol, Dimethicone Crosspolymer, Ceteareth-20, Ethylhexylglycerin, Trisodium Ethylenediamine Disuccinate, Arginine, Aluminum Hydroxide, Ammonium Polyacrylate, Carbomer, Phenoxyethanol, Fragrance, Titanium Dioxide (CI 77891), Fast Acid Magenta (CI 17200), Sunset Yellow FCF (CI 15985), Tartrazine (CI 19140), Brilliant Blue FCF (CI 42090)","Đánh giá (24) 4.7 24 đánh giá Tất cả (24) 5 (16) 4 (8) 3 (0) 2 (0) 1 (0) Có hình ảnh Chia sẻ nhận xét của bạn về sản phẩm này Viết đánh giá 24 đánh giá cho sản phẩm này Ngày đánh giá 1 2 3 4 5 Hường Tora 4 Hài lòng | 2025-09-17, 02:37 Son Kem Lì 3CE Casual Affair - Hồng Nho 4.6g Tại sao dưới đáy son lúc thì made in korea, lúc thì lại made in china vậy shop Hasaki Hasaki xin chào! Hasaki cảm ơn Hường Tora đã dành thời gian đánh giá. Sự hài lòng của khách hàng là động lực to lớn để Hasaki ngày càng phát triển hơn nữa về chất lượng dịch vụ. Cảm ơn bạn đã tin tưởng và mua sắm tại Hasaki! Phan Nguyên Giao 5 Rất hài lòng | 2025-09-12, 09:25 Son Kem Lì 3CE Laydown - Thạch Trà Ô Long 4.6g màu laydown ấm hơn màu double wind, dw lạnh hơn, thiên tím thiên ruốc và đậm hơn, laydown dễ dùng thường ngày hơn Hasaki Hasaki xin chào! Hasaki cảm ơn Phan Nguyên Giao đã dành thời gian đánh giá. Sự hài lòng của khách hàng là động lực to lớn để Hasaki ngày càng phát triển hơn nữa về chất lượng dịch vụ. Cảm ơn bạn đã tin tưởng và mua sắm tại Hasaki! Võ Thị Ngọc Huyền 5 Rất hài lòng | 2025-09-09, 10:25 Son Kem Lì 3CE Chasing Rose - Hồng Kem Sữa 4.6g Son màu mịn lì tệp vào môi nhưng ko hợp da ấm như mình. Son mới nhận hàng 09/09 mới quẹt cọ 1 lần để thử màu. Pass 150k zalo 0399183995. Mình ở tphcm ạ Hasaki Hasaki xin chào! Hasaki cảm ơn Võ Thị Ngọc Huyền đã dành thời gian đánh giá. Sự hài lòng của khách hàng là động lực to lớn để Hasaki ngày càng phát triển hơn nữa về chất lượng dịch vụ. Cảm ơn bạn đã tin tưởng và mua sắm tại Hasaki! THU HÀ 5 Rất hài lòng | 2025-08-04, 04:23 Son Kem Lì 3CE Sepia - Đỏ Táo Trầm 4.6g Pass Son 3CE - Sepia 130k Mới mua ở Hasaki, mới nhận hàng lúc 10h50 (04/08) test thử do không hợp màu nên pass lại cho bạn nào cần, son còn mới tinh luôn ạ Alo em 0989775044, ai cần alo em ship tận nơi, có bill đàng hoàng anh chị check hàng auth chuẩn yên tâm ạ Hasaki Hasaki xin chào! Hasaki cảm ơn THU HÀ đã dành thời gian đánh giá. Sự hài lòng của khách hàng là động lực to lớn để Hasaki ngày càng phát triển hơn nữa về chất lượng dịch vụ. Cảm ơn bạn đã tin tưởng và mua sắm tại Hasaki! Chi Chi 5 Rất hài lòng | 2025-07-25, 07:01 Son Kem Lì 3CE Laydown - Thạch Trà Ô Long 4.6g màu son đẹp , chất son kem lì ko bị khô môi Hasaki Hasaki xin chào! Hasaki cảm ơn Chi Chi đã dành thời gian đánh giá. Sự hài lòng của khách hàng là động lực to lớn để Hasaki ngày càng phát triển hơn nữa về chất lượng dịch vụ. Cảm ơn bạn đã tin tưởng và mua sắm tại Hasaki! 24 đánh giá cho sản phẩm này Ngày đánh giá 1 2 3 4 5"
Son Dưỡng Môi DHC Không Màu Hỗ Trợ Giảm Thâm Môi 1.5g,DHC,140.000 ₫,199.000 ₫,-30 %,https://media.hcdn.vn/catalog/product/f/a/facebook-dynamic-son-duong-moi-khong-mau-dhc-ho-tro-giam-tham-moi-1-5g-1726645943_img_320x320_b04c1a_fit_center.jpg,https://hasaki.vn/san-pham/son-duong-moi-khong-mau-dhc-ho-tro-giam-tham-moi-1-5g-6710.html,Lip Cream,5.0,,284/tháng,8%,,https://hasaki.vn/danh-muc/trang-diem-moi-c24.html,140.000 ₫,"Son Dưỡng Môi DHC Không Màu Hỗ Trợ Giảm Thâm Môi 1.5g là sản phẩm son dưỡng môi đến từ thương hiệu DHC của Nhật Bản. Công thức son chứa chiết xuất từ Olive đậm đặc sẽ giúp dưỡng ẩm và khoá ẩm cho đôi môi lên đến 8 giờ, cải thiện hiệu quả tình trạng da môi khô nứt nẻ, đồng thời giảm thâm và làm hồng môi. Đặc biệt, son hoàn toàn không gây cảm giác bóng nhờn, bết dính hay nặng môi. Sản phẩm chỉ để lại một lớp màng mỏng nhẹ, giúp tạo hiệu ứng môi căng mọng, đầy đặn và có sức sống hơn. Son Dưỡng Môi DHC Lip Cream 1.5g chính hãng hiện đã có mặt tại Hasaki. Đối tượng sử dụng Son Dưỡng Môi DHC Lip Cream: Những ai có đôi môi thường xuyên bị tình trạng khô ráp, nứt nẻ, bong tróc,... Những ai thường xuyên trang điểm, cần sản phẩm giúp dưỡng mềm môi, hỗ trợ cho son môi lên màu đẹp hơn. Sản phẩm có thể sử dụng cho cả nam và nữ. Ưu thế nổi bật của Son Dưỡng Môi DHC Lip Cream: Thành phần giàu chất cấp ẩm từ dầu olive nguyên chất cùng vitamin E và lô hội: Dưỡng môi mềm mịn, bảo vệ môi trước nhiều tác động và giữ cho đôi môi căng mọng suốt ngày dài. Ngăn ngừa các dấu hiệu lão hóa, hỗ trợ giảm thâm môi hiệu quả, làm hồng môi và khắc phục tình trạng nứt rãnh môi. Có thể dùng son DHC làm lớp nền hoàn hảo trước khi thoa son màu. Độ an toàn: Không hương liệu. Không chất tạo màu. Không paraben. Hướng dẫn bảo quản Son Dưỡng Môi DHC Lip Cream: Bảo quản sản phẩm ở nơi khô ráo, thoáng mát, tránh tiếp xúc trực tiếp với ánh nắng mặt trời. Đậy kín nắp sau mỗi lần sử dụng để ngăn ngừa sản phẩm bị oxy hóa hoặc nhiễm khuẩn. Không để sản phẩm ở nơi có nhiệt độ quá cao (trên 30°C) hoặc độ ẩm quá lớn để duy trì chất lượng. Để xa tầm tay trẻ em. Lưu ý: Tác dụng có thể khác nhau tuỳ cơ địa của người dùng Làm sao để phân biệt hàng có trộn hay không? Hàng trộn sẽ không thể xuất hoá đơn GTGT (VAT) 100% được do có hàng không nguồn gốc trong đó. Tại Hasaki, 100% hàng bán ra sẽ được xuất hoá đơn GTGT cho dù khách hàng có lấy hay không. Nếu có nhu cầu lấy hoá đơn GTGT, quý khách vui lòng cung cấp thông tin xuất hóa đơn trong vòng 2 giờ sau khi nhận hàng và trước 22h30 cùng ngày. 2 giờ sau khi giao hàng thành công, hệ thống Hasaki sẽ tự động xuất hết hoá đơn cho những hàng hoá mà khách hàng không đăng kí lấy hoá đơn. Do 100% hàng hóa bán ra đều được xuất hết hóa đơn GTGT trong ngày nên đảm bảo 100% hàng tại Hasaki là hàng chính hãng có nguồn gốc rõ ràng. Thu gọn","{Barcode: 4511413503997, Thương Hiệu: DHC, Xuất xứ thương hiệu: Nhật Bản, Nơi sản xuất: Japan, Đặc tính: Không màu, Dung Tích: 1.5g}","Hướng dẫn sử dụng Thoa nhẹ nhàng son dưỡng DHC lên môi để dưỡng ẩm và làm mềm môi. Bạn cũng có thể dùng son dưỡng môi DHC như một lớp son nền trước khi tô son màu, vừa giúp son lên màu đẹp lại vừa dưỡng ẩm và bảo vệ đôi môi không bị bong tróc hay thâm sạm. Lưu ý: Nên tẩy tế bào chết và lau sạch lớp son cũ trên môi trước khi thoa son dưỡng môi DHC để giúp môi mềm, thẩm thấu dưỡng chất tốt hơn. Không để son dưỡng môi DHC trực tiếp dưới ánh nắng mặt trời hoặc ở nơi có nhiệt độ cao (đặc biệt là cốp xe) để tránh làm son bị chảy, hỏng.","Thành phần sản phẩm Thành phần chính: Thành phần giàu chất cấp ẩm từ dầu olive nguyên chất cùng vitamin E và lô hội: giúp dưỡng ẩm sâu, hỗ trợ chống oxy hoá, bảo vệ và ngăn ngừa lão hoá môi. Thành phần chi tiết: Caprylic/Capric Triglyceride, Euphorbia Cerifera (Candelilla) Wax/Candelilla Cera/Cire De Candelilla, Beeswax/Cera Alba/Cire D’abeille, Stearic Acid, Squalane, Pentylene Glycol, Tocopherol, Phenoxyethanol, Stearyl Glycyrrhetinate.","Đánh giá (46) 5 46 đánh giá Tất cả (46) 5 (44) 4 (2) 3 (0) 2 (0) 1 (0) Có hình ảnh Chia sẻ nhận xét của bạn về sản phẩm này Viết đánh giá 46 đánh giá cho sản phẩm này Ngày đánh giá 1 2 3 4 5 … 10 Vũ Thị Minh Thuỳ 5 Rất hài lòng | 2025-08-13, 16:27 Son Dưỡng Môi DHC Không Màu Hỗ Trợ Giảm Thâm Môi 1.5g chiều ngày 13/8 cỡ 4h hơn mình có ghé mua đơn hàng 680, trong đó có thỏi dhc này nhưng k dc tặng mặt nạ Hasaki Hasaki xin chào! Hasaki cảm ơn Vũ Thị Minh Thuỳ đã dành thời gian đánh giá. Sự hài lòng của khách hàng là động lực to lớn để Hasaki ngày càng phát triển hơn nữa về chất lượng dịch vụ. Cảm ơn bạn đã tin tưởng và mua sắm tại Hasaki! c loan 5 Rất hài lòng | 2025-06-27, 03:54 Son Dưỡng Môi DHC Không Màu Hỗ Trợ Giảm Thâm Môi 1.5g Son này bầu sử dụng được không shop Hasaki Hasaki xin chào! Hasaki cảm ơn c loan đã dành thời gian đánh giá. Sự hài lòng của khách hàng là động lực to lớn để Hasaki ngày càng phát triển hơn nữa về chất lượng dịch vụ. Cảm ơn bạn đã tin tưởng và mua sắm tại Hasaki! Huyền Thu Đã mua hàng 5 Rất hài lòng | 2025-01-29, 17:06 Son Dưỡng Môi DHC Không Màu Hỗ Trợ Giảm Thâm Môi 1.5g tối đi ngủ bôi dày sáng dậy môi hồng hào ko 1 nếp nhăn làm cho môi mềm rất đẹp sẽ mua lại ở lần sau Trần Thị Hà Phương Đã mua hàng 5 Rất hài lòng | 2024-12-02, 11:22 Son Dưỡng Môi DHC Không Màu Hỗ Trợ Giảm Thâm Môi 1.5g Sau khi sử dụng 2 tháng mình chụp hình môi lại so sánh với ảnh mới sử dụng thì thấy môi có mờ thâm 1 chút và đỡ khô hơn. Các bạn bị thâm môi có thể xài em này kiên trì sử dụng sẽ có hiệu quả. Nhớ chụp ảnh lại khi mới sử dụng và ảnh sau khi xài 2_3 thấy mới thấy được sự cải thiện vì mình nhìn gương hàng ngày sẽ k biết được. Hien Đã mua hàng 5 Rất hài lòng | 2024-08-24, 10:42 Son Dưỡng Môi DHC Không Màu Hỗ Trợ Giảm Thâm Môi 1.5g Xài mướt, cảm giác nhẹ môi chứ k nặng dàyooi như những loại khác. Đã xài mấy cây rồi mới review. 46 đánh giá cho sản phẩm này Ngày đánh giá 1 2 3 4 5 … 10"
Son Tint Lì Mastige Blur Lâu Trôi Màu B5 Đỏ Gạch 3.8g,Mastige,189.000 ₫,359.000 ₫,-47 %,https://media.hcdn.vn/catalog/product/p/r/promotions-auto-son-kem-mastige-min-mo-b5-classic-do-gach-3-8g_JfD4cJ1YpaFis35y_img_320x320_b04c1a_fit_center.png,https://hasaki.vn/san-pham/son-kem-mastige-min-mo-b5-classic-do-gach-3-8g-186288.html,Blur Lip Tint - B5 Classic,5.0,,1/tháng,55%,,https://hasaki.vn/danh-muc/trang-diem-moi-c24.html,189.000 ₫,"Son Kem Mastige Blur Lip Tint Mịn Mờ 3.8g là sản phẩm son kem đến từ thương hiệu mỹ phẩm Mastige Việt Nam. Mastige Blur Lip Tint mang đến trải nghiệm Tan mượt 3s – Mịn nhẹ 8h. Chất son tint lỏng dễ tán, Chạm môi là tan – Lì mờ như nhung – Nhẹ như không khí, mịn lì lâu trôi với lớp blur tự nhiên tan và khoá chặt trên môi. Hiện sản phẩm Son Kem Mastige Blur Lip Tint Mịn Mờ 3.8g đã có mặt tại Hasaki với 6 tông màu: B1 Individual - Hồng Dâu B2 Lady Like - Hồng Cam Sữa B3 Preppy - Cam Cháy B4 Retro - Hồng Trà B5 Classic - Đỏ Gạch B6 Chic - Đỏ Hồng Ưu thế nổi bật: Công nghệ hiện đại, tích hợp 3 công nghệ: Công nghệ infused water với 43% hàm lượng nước giúp môi cảm giác mát tức thì, vực dậy đôi môi đang khô của bạn, nhờ đó môi khi mới thoa có cảm giác căng tràn sức sống. Hiệu ứng chuyển đổi chất giúp chất tint dễ tán sang hiệu ứng blur trên môi, tạo cảm giác môi mịn, nhẹ, trông tự nhiên hơn. Công nghệ khoá màu giúp cho lớp Blur tuy mỏng nhẹ nhưng lại bền màu lâu trôi, ở trên môi và khoá luôn cả độ ẩm mịn cho môi lúc nào cũng Mỏng Nhẹ - Mềm Mịn - Đều Màu. Che phủ hoàn hảo: Làm mờ rãnh môi, tạo lớp finish đều màu và mềm mịn. Vegan thuần chay: Thành phần an toàn, thân thiện với môi trường. Bảng màu đa dạng: 6 sắc thái dẫn đầu xu hướng, phù hợp mọi phong cách. Đầu cọ thông minh, chất liệu lông và đầu vát được thiết kế tỉ mỉ và đa năng, giúp dễ lấy lượng son vừa đủ, tán mượt các dùng to nhỏ và linh hoạt di chuyển trên môi khi thoa. Bao bì chắc chắn, sang trọng. Hiệu quả sử dụng: Lúc mới thoa, chất son tint lỏng nhe, tan chảy và phủ đầy rãnh môi. Lớp finish lì, mịn tự nhiên như nhung, nhẹ nhàng và thoải mái. Màu sắc bền lâu, không trôi suốt 8h. Đôi môi được dưỡng mềm mại, không khô ráp hay bong tróc. Bảo quản: Bảo quản nơi khô ráo và tránh ánh nắng mặt trời. Tránh xa tầm với của trẻ em. Thông số sản phẩm: Dung tích: 3.8g Thương hiệu: Mastige Xuất xứ thương hiệu: Việt Nam Sản xuất tại: Hàn Quốc. Lưu ý: Tác dụng có thể khác nhau tuỳ cơ địa của người dùng Làm sao để phân biệt hàng có trộn hay không? Hàng trộn sẽ không thể xuất hoá đơn GTGT (VAT) 100% được do có hàng không nguồn gốc trong đó. Tại Hasaki, 100% hàng bán ra sẽ được xuất hoá đơn GTGT cho dù khách hàng có lấy hay không. Nếu có nhu cầu lấy hoá đơn GTGT, quý khách vui lòng cung cấp thông tin xuất hóa đơn trong vòng 2 giờ sau khi nhận hàng và trước 22h30 cùng ngày. 2 giờ sau khi giao hàng thành công, hệ thống Hasaki sẽ tự động xuất hết hoá đơn cho những hàng hoá mà khách hàng không đăng kí lấy hoá đơn. Do 100% hàng hóa bán ra đều được xuất hết hóa đơn GTGT trong ngày nên đảm bảo 100% hàng tại Hasaki là hàng chính hãng có nguồn gốc rõ ràng. Thu gọn","{Barcode: 8938552742609, Thương Hiệu: Mastige, Xuất xứ thương hiệu: Việt Nam, Nơi sản xuất: Korea, Dung Tích: 3.8g}","Hướng dẫn sử dụng Lấy một lượng son vừa đủ, thoa đều từ giữa môi ra ngoài để chất tint tan vào môi. Để màu lên chuẩn, tẩy tế bào chết môi trước khi sử dụng.","Thành phần sản phẩm Thành phần chính: Tocopherol (Vitamin E): giúp chống oxy hóa, ngăn ngừa lão hóa và thâm môi Dimethicone & Arginine: giữ ẩm, duy trì độ mềm mượt.","Đánh giá (2) 5 2 đánh giá Tất cả (2) 5 (2) 4 (0) 3 (0) 2 (0) 1 (0) Có hình ảnh Chia sẻ nhận xét của bạn về sản phẩm này Viết đánh giá 2 đánh giá cho sản phẩm này Ngày đánh giá kiều diễm 5 Rất hài lòng | 2025-08-22, 13:56 Son Tint Lì Mastige Blur Lâu Trôi Màu B2 Hồng Cam Sữa 3.8g Son lên mỏng nhẹ , màu xinh tự nhiên phù hợp với makup nhẹ nhàng nha , mình thấy ưng và xinh Hasaki Hasaki xin chào! Hasaki cảm ơn kiều diễm đã dành thời gian đánh giá. Sự hài lòng của khách hàng là động lực to lớn để Hasaki ngày càng phát triển hơn nữa về chất lượng dịch vụ. Cảm ơn bạn đã tin tưởng và mua sắm tại Hasaki! Quynh anh 5 Rất hài lòng | 2025-06-18, 11:16 Son Tint Lì Mastige Blur Lâu Trôi Màu B2 Hồng Cam Sữa 3.8g E pass son new 150k thui ạ, có 1 số dòng khác Zlo:0332367556 Hasaki Hasaki xin chào! Hasaki cảm ơn Quynh anh đã dành thời gian đánh giá. Sự hài lòng của khách hàng là động lực to lớn để Hasaki ngày càng phát triển hơn nữa về chất lượng dịch vụ. Cảm ơn bạn đã tin tưởng và mua sắm tại Hasaki! 2 đánh giá cho sản phẩm này Ngày đánh giá"
